	InfoVis+SciVis	23-28 Oct. 2011	Orion: A system for modeling, transformation and visualization of multidimensional heterogeneous networks	10.1109/VAST.2011.6102441	http://dx.doi.org/10.1109/VAST.2011.6102441	51	60	6102441	data visualisation;graph theory;graphical user interfaces;social networking (online)	Orion interface;academic collaboration;declarative workflow language;distributed software development;drag-and-drop operations;graph manipulation;multidimensional heterogeneous network modelling;multidimensional heterogeneous network transformation;multidimensional heterogeneous network visualization;network analytics;online health communities;relational operators;social networks	Analytical models;Communities;Data models;Data visualization;Joining processes;Social network services	data management;data transformation;end-user programming;graphs;social network analysis;visualization	The study of complex activities such as scientific production and software development often require modeling connections among heterogeneous entities including people, institutions and artifacts. Despite numerous advances in algorithms and visualization techniques for understanding such social networks, the process of constructing network models and performing exploratory analysis remains difficult and time-consuming. In this paper we present Orion, a system for interactive modeling, transformation and visualization of network data. Orion's interface enables the rapid manipulation of large graphs-including the specification of complex linking relationships-using simple drag-and-drop operations with desired node types. Orion maps these user interactions to statements in a declarative workflow language that incorporates both relational operators (e.g., selection, aggregation and joins) and network analytics (e.g., centrality measures). We demonstrate how these features enable analysts to flexibly construct and compare networks in domains such as online health communities, academic collaboration and distributed software development.	Heer, J.;Perer, A.	Stanford Univ., Stanford, CA, USA|c|;	37550791300;37294938400
	InfoVis+SciVis	23-28 Oct. 2011	G-PARE: A visual analytic tool for comparative analysis of uncertain graphs	10.1109/VAST.2011.6102442	http://dx.doi.org/10.1109/VAST.2011.6102442	61	70	6102442	data visualisation;graph theory;learning (artificial intelligence)	G-PARE;adaptive exploration environment;comparative analysis;machine learning algorithms;uncertain graphs;visual analytic tool	Data models;Data visualization;Machine learning algorithms;Prediction algorithms;Predictive models;Uncertainty;Visualization	Comparative Analysis;Model Comparison;Uncertain Graphs;Visualizing Uncertainty	There are a growing number of machine learning algorithms which operate on graphs. Example applications for these algorithms include predicting which customers will recommend products to their friends in a viral marketing campaign using a customer network, predicting the topics of publications in a citation network, or predicting the political affiliations of people in a social network. It is important for an analyst to have tools to help compare the output of these machine learning algorithms. In this work, we present G-PARE, a visual analytic tool for comparing two uncertain graphs, where each uncertain graph is produced by a machine learning algorithm which outputs probabilities over node labels. G-PARE provides several different views which allow users to obtain a global overview of the algorithms output, as well as focused views that show subsets of nodes of interest. By providing an adaptive exploration environment, G-PARE guides the users to places in the graph where two algorithms predictions agree and places where they disagree. This enables the user to follow cascades of misclassifications by comparing the algorithms outcome with the ground truth. After describing the features of G-PARE, we illustrate its utility through several use cases based on networks from different domains.	Sharara, H.;Sopan, A.;Namata, G.;Getoor, L.;Singh, L.	Comput. Sci. Dept., Univ. of Maryland, College Park, MD, USA|c|;;;;	37714206000;37546693400;38072149500;37829614900;37691176100
	InfoVis+SciVis	23-28 Oct. 2011	Visual social network analytics for relationship discovery in the enterprise	10.1109/VAST.2011.6102443	http://dx.doi.org/10.1109/VAST.2011.6102443	71	79	6102443	data mining;data visualisation;graph theory;social networking (online)	SaNDVis;enterprise setting;expertise location;people-centric tasks;relationship discovery tasks;social graph;social media;team building;team coordination;visual social network analytics	Blogs;Databases;Information services;Internet;Social network services;Tagging;Visual analytics	information discovery;social data mining;social networks;social visualization	As people continue to author and share increasing amounts of information in social media, the opportunity to leverage such information for relationship discovery tasks increases. In this paper, we describe a set of systems that mine, aggregate, and infer a social graph from social media inside an enterprise, resulting in over 73 million relationships between 450,000 people. We then describe SaNDVis, a novel visual analytics tool that supports people-centric tasks like expertise location, team building, and team coordination in the enterprise. We also provide details of a 12-month-long, large-scale deployment to almost 1,800 users from which we extract dominant use cases from log and interview data. By integrating social position, evidence, and facets into SaNDVis, we demonstrate how users can use a visual analytics tool to reflect on existing relationships as well as build new relationships in an enterprise setting.	Perer, A.;Guy, I.;Uziel, E.;Ronen, I.;Jacovi, M.	IBM Res., Yorktown Heights, NY, USA|c|;;;;	37294938400;37826398500;38233626100;38232518800;37990793800
	InfoVis+SciVis	23-28 Oct. 2011	How locus of control influences compatibility with visualization style	10.1109/VAST.2011.6102445	http://dx.doi.org/10.1109/VAST.2011.6102445	81	90	6102445	data visualisation;user interfaces	cognitive psychology;containment metaphor;control locus;indentation metaphor;individual personality difference;personality trait;user needs;user preference;user speed;visual analytics design;visualization design;visualization style compatibility;visualization system	Correlation;Data visualization;Encoding;Layout;Particle measurements;Visual analytics		Existing research suggests that individual personality differences are correlated with a user's speed and accuracy in solving problems with different types of complex visualization systems. In this paper, we extend this research by isolating factors in personality traits as well as in the visualizations that could have contributed to the observed correlation. We focus on a personality trait known as locus of control, which represents a person's tendency to see themselves as controlled by or in control of external events. To isolate variables of the visualization design, we control extraneous factors such as color, interaction, and labeling, and specifically focus on the overall layout style of the visualizations. We conduct a user study with four visualizations that gradually shift from an indentation metaphor to a containment metaphor and compare the participants' speed, accuracy, and preference with their locus of control. Our findings demonstrate that there is indeed a correlation between the two: participants with an internal locus of control perform more poorly with visualizations that employ a containment metaphor, while those with an external locus of control perform well with such visualizations. We discuss a possible explanation for this relationship based in cognitive psychology and propose that these results can be used to better understand how people use visualizations and how to adapt visual analytics design to an individual user's needs.	Ziemkiewicz, C.;Crouser, R.J.;Yauilla, A.R.;Su, S.L.;Ribarsky, W.;Chang, R.	Brown Univ., Providence, RI, USA|c|;;;;;	37548028800;38229914800;38233580400;38240721700;37300425000;37592409400
	InfoVis+SciVis	23-28 Oct. 2011	Obvious: A meta-toolkit to encapsulate information visualization toolkits &#x2014; One toolkit to bind them all	10.1109/VAST.2011.6102446	http://dx.doi.org/10.1109/VAST.2011.6102446	91	100	6102446	Java;data visualisation;learning (artificial intelligence)	Improvise;InfoVis Toolkit;JUNG;Java language;Obvious;Prefuse;Rapid-Miner;Weka;coevolution process;data management libraries;data models;information visualization toolkit encapsulation;machine-learning toolkits;meta-toolkit;visual analytics application development	Data models;Data visualization;Java;Libraries;Observers;Visualization		This article describes Obvious: a meta-toolkit that abstracts and encapsulates information visualization toolkits implemented in the Java language. It intends to unify their use and postpone the choice of which concrete toolkit(s) to use later-on in the development of visual analytics applications. We also report on the lessons we have learned when wrapping popular toolkits with Obvious, namely Prefuse, the InfoVis Toolkit, partly Improvise, JUNG and other data management libraries. We show several examples on the uses of Obvious, how the different toolkits can be combined, for instance sharing their data models. We also show how Weka and Rapid-Miner, two popular machine-learning toolkits, have been wrapped with Obvious and can be used directly with all the other wrapped toolkits. We expect Obvious to start a co-evolution process: Obvious is meant to evolve when more components of Information Visualization systems will become consensual. It is also designed to help information visualization systems adhere to the best practices to provide a higher level of interoperability and leverage the domain of visual analytics.	Fekete, J.;Hemery, P.;Baudel, T.;Wood, J.	INRIA, Sophia Antipolis, France|c|;;;	37407972900;38072289200;38233516200;37399045100
	InfoVis+SciVis	23-28 Oct. 2011	Supporting effective common ground construction in Asynchronous Collaborative Visual Analytics	10.1109/VAST.2011.6102447	http://dx.doi.org/10.1109/VAST.2011.6102447	101	110	6102447	data analysis;data visualisation;user interfaces	asynchronous collaborative visual analytics;user interaction technique;user study;visualization technique	Animation;Collaboration;Correlation;History;Semantics;Visual analytics	Visual analytics;asynchronous collaboration;insight;multidimensional visualization	Asynchronous Collaborative Visual Analytics (ACVA) leverages group sensemaking by releasing the constraints on when, where, and who works collaboratively. A significant task to be addressed before ACVA can reach its full potential is effective common ground construction, namely the process in which users evaluate insights from individual work to develop a shared understanding of insights and collectively pool them. This is challenging due to the lack of instant communication and scale of collaboration in ACVA. We propose a novel visual analytics approach that automatically gathers, organizes, and summarizes insights to form common ground with reduced human effort. The rich set of visualization and interaction techniques provided in our approach allows users to effectively and flexibly control the common ground construction and review, explore, and compare insights in detail. A working prototype of the approach has been implemented. We have conducted a case study and a user study to demonstrate its effectiveness.	Yang Chen;Alsakran, J.;Barlowe, S.;Jing Yang;Ye Zhao	Univ. of North Carolina at Charlotte, Charlotte, NC, USA|c|;;;;	37600587200;37846905500;37591128900;37292632600;37277701200
	InfoVis+SciVis	23-28 Oct. 2011	Guiding feature subset selection with an interactive visualization	10.1109/VAST.2011.6102448	http://dx.doi.org/10.1109/VAST.2011.6102448	111	120	6102448	data analysis;data visualisation;statistical analysis	SmartStripes;data analysis;entity subset selection;feature correlation;feature subset selection algorithms;filter techniques;high-dimensional data table visualization;interactive visualization;statistical aggregation;statistical ranking measures	Algorithm design and analysis;Atmospheric measurements;Correlation;Data visualization;Particle measurements;Sorting;Visualization		We propose a method for the semi-automated refinement of the results of feature subset selection algorithms. Feature subset selection is a preliminary step in data analysis which identifies the most useful subset of features (columns) in a data table. So-called filter techniques use statistical ranking measures for the correlation of features. Usually a measure is applied to all entities (rows) of a data table. However, the differing contributions of subsets of data entities are masked by statistical aggregation. Feature and entity subset selection are, thus, highly interdependent. Due to the difficulty in visualizing a high-dimensional data table, most feature subset selection algorithms are applied as a black box at the outset of an analysis. Our visualization technique, SmartStripes, allows users to step into the feature subset selection process. It enables the investigation of dependencies and interdependencies between different feature and entity subsets. A user may even choose to control the iterations manually, taking into account the ranking measures, the contributions of different entity subsets, as well as the semantics of the features.	May, T.;Bannach, A.;Davey, J.;Ruppert, T.;Kohlhammer, J.	Fraunhofer Inst. for Comput. Graphics Res., Darmstadt, Germany|c|;;;;	37603783600;38233628300;37603822500;37593423500;37449689200
	InfoVis+SciVis	23-28 Oct. 2011	Observation-level interaction with statistical models for visual analytics	10.1109/VAST.2011.6102449	http://dx.doi.org/10.1109/VAST.2011.6102449	121	130	6102449	data analysis;data visualisation;principal component analysis;probability	data interactive visual exploration;exploratory interaction;expressive interaction;generative topographic mapping;multidimensional scaling;observation-level interaction;parameter adjustments;probabilistic principal component analysis;sensemaking process;statistical models;visual analytics	Analytical models;Data models;Data visualization;Layout;Principal component analysis;Visual analytics	observation-level interaction;statistical models;visual analytics	In visual analytics, sensemaking is facilitated through interactive visual exploration of data. Throughout this dynamic process, users combine their domain knowledge with the dataset to create insight. Therefore, visual analytic tools exist that aid sensemaking by providing various interaction techniques that focus on allowing users to change the visual representation through adjusting parameters of the underlying statistical model. However, we postulate that the process of sensemaking is not focused on a series of parameter adjustments, but instead, a series of perceived connections and patterns within the data. Thus, how can models for visual analytic tools be designed, so that users can express their reasoning on observations (the data), instead of directly on the model or tunable parameters? Observation level (and thus observation) in this paper refers to the data points within a visualization. In this paper, we explore two possible observation-level interactions, namely exploratory and expressive, within the context of three statistical methods, Probabilistic Principal Component Analysis (PPCA), Multidimensional Scaling (MDS), and Generative Topographic Mapping (GTM). We discuss the importance of these two types of observation level interactions, in terms of how they occur within the sensemaking process. Further, we present use cases for GTM, MDS, and PPCA, illustrating how observation level interaction can be incorporated into visual analytic tools.	Endert, A.;Chao Han;Maiti, D.;House, L.;Leman, S.;North, C.	Dept. of Comput. Sci., Virginia Tech, Blacksburg, VA, USA|c|;;;;;	37681759500;38238038000;38232394400;38241765600;38236156800;37419565900
	InfoVis+SciVis	23-28 Oct. 2011	Pointwise local pattern exploration for sensitivity analysis	10.1109/VAST.2011.6102450	http://dx.doi.org/10.1109/VAST.2011.6102450	131	140	6102450	data analysis;data visualisation	anomalous local pattern identification;attribute space;color mapping;jittering;local analysis;multivariate datasets;multivariate phenomena analysis;multivariate visualization techniques;pointwise local pattern exploration system;visual analytic tools;visual sensitivity analysis method	Analytical models;Data mining;Image color analysis;Sensitivity analysis;Vectors;Visualization	Knowledge Discovery;local pattern visualization;sensitivity analysis	Sensitivity analysis is a powerful method for discovering the significant factors that contribute to targets and understanding the interaction between variables in multivariate datasets. A number of sensitivity analysis methods fall into the class of local analysis, in which the sensitivity is defined as the partial derivatives of a target variable with respect to a group of independent variables. Incorporating sensitivity analysis in visual analytic tools is essential for multivariate phenomena analysis. However, most current multivariate visualization techniques do not allow users to explore local patterns individually for understanding the sensitivity from a pointwise view. In this paper, we present a novel pointwise local pattern exploration system for visual sensitivity analysis. Using this system, analysts are able to explore local patterns and the sensitivity at individual data points, which reveals the relationships between a focal point and its neighbors. During exploration, users are able to interactively change the derivative coefficients to perform sensitivity analysis based on different requirements as well as their domain knowledge. Each local pattern is assigned an outlier factor, so that users can quickly identify anomalous local patterns that do not conform with the global pattern. Users can also compare the local pattern with the global pattern both visually and statistically. Finally, the local pattern is integrated into the original attribute space using color mapping and jittering, which reveals the distribution of the partial derivatives. Case studies with real datasets are used to investigate the effectiveness of the visualizations and interactions.	Zhenyu Guo;Ward, M.O.;Rundensteiner, E.A.;Ruiz, C.	Comput. Sci. Dept., Worcester Polytech. Inst., Worcester, MA, USA|c|;;;	37668783300;37268441700;37279217900;37413757400
	InfoVis+SciVis	23-28 Oct. 2011	Interactive decision making using dissimilarity to visually represented prototypes	10.1109/VAST.2011.6102451	http://dx.doi.org/10.1109/VAST.2011.6102451	141	149	6102451	data analysis;data visualisation;decision making;forensic science;learning (artificial intelligence);psychology;risk management	dissimilarity;forensic psychiatry;human prototypical reasoning;interactive decision making;interactive visualizations;machine learning approach;multidimensional heterogeneous data;prototype visual representation;risk assessment case;similarity-based classification;similarity-to-prototype approach;visual analytics context	Data mining;Data visualization;Humans;Image color analysis;Prototypes;Visual analytics	dissimilarity based classification;dissimilarity based visualization;interactive visualization;prototypes;visual analytics	To make informed decisions, an expert has to reason with multi-dimensional, heterogeneous data and analysis results of these. Items in such datasets are typically represented by features. However, as argued in cognitive science, features do not yield an optimal space for human reasoning. In fact, humans tend to organize complex information in terms of prototypes or known cases rather than in absolute terms. When confronted with unknown data items, humans assess them in terms of similarity to these prototypical elements. Interestingly, an analogues similarity-to-prototype approach, where prototypes are taken from the data, has been successfully applied in machine learning. Combining such a machine learning approach with human prototypical reasoning in a Visual Analytics context requires to integrate similarity-based classification with interactive visualizations. To that end, the data prototypes should be visually represented to trigger direct associations to cases familiar to the domain experts. In this paper, we propose a set of highly interactive visualizations to explore data and classification results in terms of dissimilarities to visually represented prototypes. We argue that this approach not only supports human reasoning processes, but is also suitable to enhance understanding of heterogeneous data. The proposed framework is applied to a risk assessment case study in Forensic Psychiatry.	Migut, M.A.;van Gemert, J.C.;Worring, M.	Intell. Syst. Lab. Amsterdam, Univ. of Amsterdam, Amsterdam, Netherlands|c|;;	37589528300;37340470100;37267865600
	InfoVis+SciVis	23-28 Oct. 2011	BaobabView: Interactive construction and analysis of decision trees	10.1109/VAST.2011.6102453	http://dx.doi.org/10.1109/VAST.2011.6102453	151	160	6102453	data visualisation;decision trees;interactive systems	BaobabView;algorithmic support;domain expert;interactive construction;scalable decision tree visualization	Accuracy;Algorithm design and analysis;Data visualization;Decision trees;Histograms;Impurities;Training		We present a system for the interactive construction and analysis of decision trees that enables domain experts to bring in domain specific knowledge. We identify different user tasks and corresponding requirements, and develop a system incorporating a tight integration of visualization, interaction and algorithmic support. Domain experts are supported in growing, pruning, optimizing and analysing decision trees. Furthermore, we present a scalable decision tree visualization optimized for exploration. We show the effectiveness of our approach by applying the methods to two use cases. The first case illustrates the advantages of interactive construction, the second case demonstrates the effectiveness of analysis of decision trees and exploration of the structure of the data.	van den Elzen, S.;van Wijk, J.J.	Eindhoven Univ. of Technol., Eindhoven, Netherlands|c|;	38233594700;37267249200
	InfoVis+SciVis	23-28 Oct. 2011	From movement tracks through events to places: Extracting and characterizing significant places from mobility data	10.1109/VAST.2011.6102454	http://dx.doi.org/10.1109/VAST.2011.6102454	161	170	6102454	data analysis;data visualisation;pattern clustering	data aggregation analysis;event clustering;event extraction;event spatio-temporal aggregation;mobility data;movement data analysis;movement tracks;place characterization;place extraction;trajectory spatio-temporal aggregation;visual analytics procedure	Aggregates;Clustering algorithms;Context;Data mining;Time series analysis;Trajectory;Visualization	movement;spatial clustering;spatial events;spatio-temporal clustering;spatio-temporal data;trajectories	We propose a visual analytics procedure for analyzing movement data, i.e., recorded tracks of moving objects. It is oriented to a class of problems where it is required to determine significant places on the basis of certain types of events occurring repeatedly in movement data. The procedure consists of four major steps: (1) event extraction from trajectories; (2) event clustering and extraction of relevant places; (3) spatio-temporal aggregation of events or trajectories; (4) analysis of the aggregated data. All steps are scalable with respect to the amount of the data under analysis. We demonstrate the use of the procedure by example of two real-world problems requiring analysis at different spatial scales.	Andrienko, G.;Andrienko, N.;Hurter, C.;Rinzivillo, S.;Wrobel, S.	Fraunhofer Inst., Univ. of Bonn, Bonn, Germany|c|;;;;	37283047100;37283047700;38017336200;37670571400;37668062300
	InfoVis+SciVis	23-28 Oct. 2011	Visual analysis of route diversity	10.1109/VAST.2011.6102455	http://dx.doi.org/10.1109/VAST.2011.6102455	171	180	6102455	Global Positioning System;data analysis;data visualisation;statistics;traffic engineering computing	GPS navigation systems;Microsoft T-drive;high dimensional attributes;route diversity;route suggestion;source-destination pairs;statistics;taxi drivers;trajectory visualization method;transportation management;visual analysis	Cities and towns;Data visualization;Layout;Roads;Trajectory;Vehicles;Visualization		Route suggestion is an important feature of GPS navigation systems. Recently, Microsoft T-drive has been enabled to suggest routes chosen by experienced taxi drivers for given source/destination pairs in given time periods, which often take less time than the routes calculated according to distance. However, in real environments, taxi drivers may use different routes to reach the same destination, which we call route diversity. In this paper we first propose a trajectory visualization method that examines the regions where the diversity exists and then develop several novel visualization techniques to display the high dimensional attributes and statistics associated with different routes to help users analyze diversity patterns. Our techniques have been applied to the real trajectory data of thousands of taxis and some interesting findings about route diversity have been obtained. We further demonstrate that our system can be used not only to suggest better routes for drivers but also to analyze traffic bottlenecks for transportation management.	He Liu;Lu Lu;Huamin Qu;Ni, L.M.	Hong Kong Univ. of Sci. & Technol., Hong Kong, China|c|;;;	;38240091500;37272637300;38236797100
