	InfoVis+SciVis	Sept.-Oct. 2006	Hub-based Simulation and Graphics Hardware Accelerated Visualization for Nanotechnology Applications	10.1109/TVCG.2006.150	http://dx.doi.org/10.1109/TVCG.2006.150	1061	1068	4015465	computer graphic equipment;data visualisation;flow visualisation;mesh generation;middleware;nanotechnology;online front-ends;physics computing;rendering (computer graphics)	Hub-based simulation;Web browser;computational nanotechnology application;graphics hardware accelerated visualization;grid supercomputing resources;middleware;science gateway	Acceleration;Analytical models;Computational modeling;Graphics;Hardware;Middleware;Nanotechnology;Rendering (computer graphics);Visual analytics;Visualization	flow visualization;graphics hardware;nanotechnology simulation.;remote visualization;volume visualization	The Network for computational nanotechnology (NCN) has developed a science gateway at nanoHUB.org for nanotechnology education and research. Remote users can browse through online seminars and courses, and launch sophisticated nanotechnology simulation tools, all within their Web browser. Simulations are supported by a middleware that can route complex jobs to grid supercomputing resources. But what is truly unique about the middleware is the way that it uses hardware accelerated graphics to support both problem setup and result visualization. This paper describes the design and integration of a remote visualization framework into the nanoHUB for interactive visual analytics of nanotechnology simulations. Our services flexibly handle a variety of nanoscience simulations, render them utilizing graphics hardware acceleration in a scalable manner, and deliver them seamlessly through the middleware to the user. Rendering is done only on-demand, as needed, so each graphics hardware unit can simultaneously support many user sessions. Additionally, a novel node distribution scheme further improves our system's scalability. Our approach is not only efficient but also cost-effective. Only half-dozen render nodes are anticipated to support hundreds of active tool sessions on the nanoHUB. Moreover, this architecture and visual analytics environment provides capabilities that can serve many areas of scientific simulation and analysis beyond nanotechnology with its ability to interactively analyze and visualize multivariate scalar and vector fields	Wei Qiao;McLennan, M.;Kennell, R.;Ebert, D.S.;Klimeck, G.	Purdue Univ., West Lafayette, IN|c|;;;;	37282552800;37393469800;37393471900;37282598900;37270404800
	InfoVis+SciVis	Sept.-Oct. 2006	Feature Aligned Volume Manipulation for Illustration and Visualization	10.1109/TVCG.2006.144	http://dx.doi.org/10.1109/TVCG.2006.144	1069	1076	4015466	computer graphic equipment;data visualisation;medical computing;rendering (computer graphics)	GPU-based technique;anatomical structure;biological structure;data visualization;feature aligned volume manipulation;medical illustration;segment alignment;surface alignment;surgical procedure;volume graphics;volumetric model	Biological system modeling;Biology computing;Computational modeling;Computer graphics;Data visualization;Deformable models;Rendering (computer graphics);Silver;Skin;Surgery	GPU computing;Illustrative manipulation;Illustrative visualization;computer-assisted medical illustration;volume deformation;volume rendering	In this paper we describe a GPU-based technique for creating illustrative visualization through interactive manipulation of volumetric models. It is partly inspired by medical illustrations, where it is common to depict cuts and deformation in order to provide a better understanding of anatomical and biological structures or surgical processes, and partly motivated by the need for a real-time solution that supports the specification and visualization of such illustrative manipulation. We propose two new feature aligned techniques, namely surface alignment and segment alignment, and compare them with the axis-aligned techniques which were reported in previous work on volume manipulation. We also present a mechanism for defining features using texture volumes, and methods for computing correct normals for the deformed volume in respect to different alignments. We describe a GPU-based implementation to achieve real-time performance of the techniques and a collection of manipulation operators including peelers, retractors, pliers and dilators which are adaptations of the metaphors and tools used in surgical procedures and medical illustrations. Our approach is directly applicable in medical and biological illustration, and we demonstrate how it works as an interactive tool for focus+context visualization, as well as a generic technique for volume graphics	Correa, C.;Silver, D.;Chen, M.	Dept. of Electr. & Comput. Eng., State Univ. of New Jersey, NJ|c|;;	37282925900;37274132700;37280982800
	InfoVis+SciVis	Sept.-Oct. 2006	Exploded Views for Volume Data	10.1109/TVCG.2006.140	http://dx.doi.org/10.1109/TVCG.2006.140	1077	1084	4015467	data visualisation;hidden feature removal;rendering (computer graphics)	GPU-based volume ray casting algorithm;context information;exploded views;force-based model;occlusion;view-dependent explosion;volume data	Casting;Computer graphics;Data visualization;Explosions;Force control;Geometry;Rendering (computer graphics);Tomography	exploded views;illustrative visualization;volume rendering	Exploded views are an illustration technique where an object is partitioned into several segments. These segments are displaced to reveal otherwise hidden detail. In this paper we apply the concept of exploded views to volumetric data in order to solve the general problem of occlusion. In many cases an object of interest is occluded by other structures. While transparency or cutaways can be used to reveal a focus object, these techniques remove parts of the context information. Exploded views, on the other hand, do not suffer from this drawback. Our approach employs a force-based model: the volume is divided into a part configuration controlled by a number of forces and constraints. The focus object exerts an explosion force causing the parts to arrange according to the given constraints. We show that this novel and flexible approach allows for a wide variety of explosion-based visualizations including view-dependent explosions. Furthermore, we present a high-quality GPU-based volume ray casting algorithm for exploded views which allows rendering and interaction at several frames per second	Bruckner, S.;Groller, M.E.	Inst. of Comput. Graphics & Algorithms, Vienna Univ. of Technol.|c|;	37265895700;37284271200
	InfoVis+SciVis	Sept.-Oct. 2006	Caricaturistic Visualization	10.1109/TVCG.2006.123	http://dx.doi.org/10.1109/TVCG.2006.123	1085	1092	4015468	art;data visualisation;face recognition;feature extraction	art;caricaturistic visualization;characteristic feature;reference model;visual representation	Art;Brain modeling;Computer graphics;Context;Evolution (biology);Face;Focusing;Humans;Quality control;Visualization	exploded views;illustrative visualization;volume rendering	Caricatures are pieces of art depicting persons or sociological conditions in a non-veridical way. In both cases caricatures are referring to a reference model. The deviations from the reference model are the characteristic features of the depicted subject. Good caricatures exaggerate the characteristics of a subject in order to accent them. The concept of caricaturistic visualization is based on the caricature metaphor. The aim of caricaturistic visualization is an illustrative depiction of characteristics of a given dataset by exaggerating deviations from the reference model. We present the general concept of caricaturistic visualization as well as a variety of examples. We investigate different visual representations for the depiction of caricatures. Further, we present the caricature matrix, a technique to make differences between datasets easily identifiable	Rautek, P.;Viola, I.;Groller, E.	Inst. of Comput. Graphics & Algorithms, Vienna Univ. of Technol.|c|;;	37828701300;37282726800;37284271200
	InfoVis+SciVis	Sept.-Oct. 2006	Visual Signatures in Video Visualization	10.1109/TVCG.2006.194	http://dx.doi.org/10.1109/TVCG.2006.194	1093	1100	4015469	feature extraction;flow visualisation;human factors;motion estimation;video retrieval;video signal processing	flow visualization technique;video clips;video visualization;visual signature representation	Biomedical imaging;Biomedical optical imaging;Bones;Computer displays;Data mining;Data visualization;Human factors;Image motion analysis;Layout;Pipelines	GPU rendering.;Video visualization;flow visualization;human factors;optical flow;user study;video processing;visual signatures;volume visualization	Video visualization is a computation process that extracts meaningful information from original video data sets and conveys the extracted information to users in appropriate visual representations. This paper presents a broad treatment of the subject, following a typical research pipeline involving concept formulation, system development, a path-finding user study, and a field trial with real application data. In particular, we have conducted a fundamental study on the visualization of motion events in videos. We have, for the first time, deployed flow visualization techniques in video visualization. We have compared the effectiveness of different abstract visual representations of videos. We have conducted a user study to examine whether users are able to learn to recognize visual signatures of motions, and to assist in the evaluation of different visualization techniques. We have applied our understanding and the developed techniques to a set of application video clips. Our study has demonstrated that video visualization is both technically feasible and cost-effective. It has provided the first set of evidence confirming that ordinary users can be accustomed to the visual features depicted in video visualizations, and can learn to recognize visual signatures of a variety of motion events	Chen, M.;Hashim, R.R.;Botchen, R.P.;Weiskopf, D.;Ertl, T.;Thornton, I.M.	Dept. of Comput. Sci., Swansea Univ.|c|;;;;;	37280982800;37829295700;37565744300;38470313000;38356649100;37591073500
	InfoVis+SciVis	Sept.-Oct. 2006	Asynchronous Distributed Calibration for Scalable and Reconfigurable Multi-Projector Displays	10.1109/TVCG.2006.121	http://dx.doi.org/10.1109/TVCG.2006.121	1101	1108	4015470	calibration;cameras;client-server systems;computer displays;distributed algorithms	asynchronous distributed calibration;camera;centralized technique;high-resolution displays;plug-and-play projector;reconfigurable multiprojector displays;single-program-multiple-data calibration algorithm	Calibration;Cameras;Computer architecture;Computer displays;Distributed computing;Fault detection;Instruments;Photometry;Project management;Two dimensional displays	Multi-projector displays;distributed algorithms.;geometric and color calibration;projector-camera systems	Centralized techniques have been used until now when automatically calibrating (both geometrically and photometrically) large high-resolution displays created by tiling multiple projectors in a 2D array. A centralized server managed all the projectors and also the camera(s) used to calibrate the display. In this paper, we propose an asynchronous distributed calibration methodology via a display unit called the plug-and-play projector (PPP). The PPP consists of a projector, camera, computation and communication unit, thus creating a self-sufficient module that enables an asynchronous distributed architecture for multi-projector displays. We present a single-program-multiple-data (SPMD) calibration algorithm that runs on each PPP and achieves a truly scalable and reconfigurable display without any input from the user. It instruments novel capabilities like adding/removing PPPs from the display dynamically, detecting faults, and reshaping the display to a reasonable rectangular shape to react to the addition/removal/faults. To the best of our knowledge, this is the first attempt to realize a completely asynchronous and distributed calibration architecture and methodology for multi-projector displays	Bhasker, E.S.;Majumder, A.	Dept. of Comput. Sci., California Univ., Irvine, CA|c|;	37828782600;37408075400
	InfoVis+SciVis	Sept.-Oct. 2006	Dynamic View Selection for Time-Varying Volumes	10.1109/TVCG.2006.137	http://dx.doi.org/10.1109/TVCG.2006.137	1109	1116	4015471	computer animation;data visualisation;dynamic programming;rendering (computer graphics)	computer animation;curvature distributions;dynamic programming approach;dynamic view selection;opacity distribution;salient feature colors;smooth transition generation;static view selection method;time-varying dataset;time-varying view selection;time-varying volumes;volume rendering images	Animation;Data visualization;Diversity reception;Dynamic programming;Image analysis;Image color analysis;Information entropy;Optimization methods;Rendering (computer graphics);Volume measurement	dynamic view selection;image based method;information entropy;optimization.;static view selection	Animation is an effective way to show how time-varying phenomena evolve over time. A key issue of generating a good animation is to select ideal views through which the user can perceive the maximum amount of information from the time-varying dataset. In this paper, we first propose an improved view selection method for static data. The method measures the quality of a static view by analyzing the opacity, color and curvature distributions of the corresponding volume rendering images from the given view. Our view selection metric prefers an even opacity distribution with a larger projection area, a larger area of salient features' colors with an even distribution among the salient features, and more perceived curvatures. We use this static view selection method and a dynamic programming approach to select time-varying views. The time-varying view selection maximizes the information perceived from the time-varying dataset based on the constraints that the time-varying view should show smooth changes of direction and near-constant speed. We also introduce a method that allows the user to generate a smooth transition between any two views in a given time step, with the perceived information maximized as well. By combining the static and dynamic view selection methods, the users are able to generate a time-varying view that shows the maximum amount of information from a time-varying data set	Guangfeng Ji;Han-Wei Shen	Ohio State Univ., Columbus, OH|c|;	37840642900;37279493500
	InfoVis+SciVis	Sept.-Oct. 2006	Enhancing Depth Perception in Translucent Volumes	10.1109/TVCG.2006.139	http://dx.doi.org/10.1109/TVCG.2006.139	1117	1124	4015472	computerised tomography;diagnostic radiography;image reconstruction;medical image processing;rendering (computer graphics);surgery;visual perception	absorptive lighting model;aerial perspective;computerised tomography volumes;depth perception enhancement;digitally reconstructed radiographs;image reconstruction;stereopsis effect;surgical planning;synthetic X-ray images;translucent volumes	Biomedical computing;Computed tomography;Diagnostic radiography;Humans;Image reconstruction;Light scattering;Orthopedic surgery;Rendering (computer graphics);Shape;Surface reconstruction	Radiograph;Stereo;Stereopsis;Volume Rendering;X--ray	We present empirical studies that consider the effects of stereopsis and simulated aerial perspective on depth perception in translucent volumes. We consider a purely absorptive lighting model, in which light is not scattered or reflected, but is simply absorbed as it passes through the volume. A purely absorptive lighting model is used, for example, when rendering digitally reconstructed radiographs (DRRs), which are synthetic X-ray images reconstructed from CT volumes. Surgeons make use of DRRs in planning and performing operations, so an improvement of depth perception in DRRs may help diagnosis and surgical planning	Kersten, M.A.;Stewart, A.J.;Troje, N.;Ellis, R.	Med. Comput. Lab., Queen''s Univ.|c|;;;	37829586000;37591698700;37828778600;37850225600
	InfoVis+SciVis	Sept.-Oct. 2006	Texturing of Layered Surfaces for Optimal Viewing	10.1109/TVCG.2006.183	http://dx.doi.org/10.1109/TVCG.2006.183	1125	1132	4015473	data analysis;data visualisation;decision trees;feature extraction;genetic algorithms;image texture;pattern classification;search problems;surface texture	Gaussian bumps;data analysis methods;decision trees;genetic algorithm;layered three-dimensional surface texturing;linear discriminant analysis;noisy terrain fields;parallel coordinates;parameterized texture space;perceptual optimal visualizations;texture parameter space search;texture pattern generation	Analysis of variance;Data analysis;Gaussian noise;Genetic algorithms;Guidelines;Humans;Linear discriminant analysis;Space exploration;Surface texture;Visualization	data mining;decision trees;genetic algorithm;human-in-the-loop;layered surfaces;linear discriminant analysis;optimal visualization;parallel coordinates;perception	"This paper is a contribution to the literature on perceptually optimal visualizations of layered three-dimensional surfaces. Specifically, we develop guidelines for generating texture patterns, which, when tiled on two overlapped surfaces, minimize confusion in depth-discrimination and maximize the ability to localize distinct features. We design a parameterized texture space and explore this texture space using a ""human in the loop"" experimental approach. Subjects are asked to rate their ability to identify Gaussian bumps on both upper and lower surfaces of noisy terrain fields. Their ratings direct a genetic algorithm, which selectively searches the texture parameter space to find fruitful areas. Data collected from these experiments are analyzed to determine what combinations of parameters work well and to develop texture generation guidelines. Data analysis methods include ANOVA, linear discriminant analysis, decision trees, and parallel coordinates. To confirm the guidelines, we conduct a post-analysis experiment, where subjects rate textures following our guidelines against textures violating the guidelines. Across all subjects, textures following the guidelines consistently produce high rated textures on an absolute scale, and are rated higher than those that did not follow the guidelines"	Bair, A.S.;House, D.H.;Ware, C.	Texas A&M Univ., College Station, TX|c|;;	37565577300;37284216700;37265850800
	InfoVis+SciVis	Sept.-Oct. 2006	Subjective Quantification of Perceptual Interactions among some 2D Scientific Visualization Methods	10.1109/TVCG.2006.180	http://dx.doi.org/10.1109/TVCG.2006.180	1133	1140	4015474	Poisson distribution;data visualisation;graphical user interfaces;visual perception	2D icon-based visualization methods;2D scientific visualization methods;Poisson-disk distributed icons;ad-hoc artificial datasets;filtering interference;icon brightness;icon size;icon spacing;multivalued data visualization;perceptual interactions;scientific dataset visualization;spatial resolution;visual elements	Brightness;Data visualization;Design optimization;Displays;Filtering;Graphics;Information analysis;Interference;Spatial resolution;Stress	2D visualization methods;Perception models;perceptual interactions;visual design.;visualization evaluation	We present an evaluation of a parameterized set of 2D icon-based visualization methods where we quantified how perceptual interactions among visual elements affect effective data exploration. During the experiment, subjects quantified three different design factors for each method: the spatial resolution it could represent, the number of data values it could display at each point, and the degree to which it is visually linear. The class of visualization methods includes Poisson-disk distributed icons where icon size, icon spacing, and icon brightness can be set to a constant or coupled to data values from a 2D scalar field. By only coupling one of those visual components to data, we measured filtering interference for all three design factors. Filtering interference characterizes how different levels of the constant visual elements affect the evaluation of the data-coupled element. Our novel experimental methodology allowed us to generalize this perceptual information, gathered using ad-hoc artificial datasets, onto quantitative rules for visualizing real scientific datasets. This work also provides a framework for evaluating visualizations of multi-valued data that incorporate additional visual cues, such as icon orientation or color	Acevedo, D.;Laidlaw, D.H.	Dept. of Comput. Sci., Brown Univ., Providence, RI|c|;	38180784500;37275712600
	InfoVis+SciVis	Sept.-Oct. 2006	Occlusion-Free Animation of Driving Routes for Car Navigation Systems	10.1109/TVCG.2006.167	http://dx.doi.org/10.1109/TVCG.2006.167	1141	1148	4015475	computer animation;driver information systems;navigation;solid modelling	2D screen arrangement;3D terrain surface;car navigation systems;continuously deforming inverse problem;nonperspective image;nonperspective terrain navigation;occlusion-free driving routes animation;occlusion-free geographical landmark animation;visually-pleasing navigation frames	Animation;Geometry;Inverse problems;Layout;Navigation;Rendering (computer graphics);Roads;Shape;Surface texture;Visual perception	car navigation systems;nonperspective projection;occlusion-free animation;temporal coherence;visual perception	This paper presents a method for occlusion-free animation of geographical landmarks, and its application to a new type of car navigation system in which driving routes of interest are always visible. This is achieved by animating a nonperspective image where geographical landmarks such as mountain tops and roads are rendered as if they are seen from different viewpoints. The technical contribution of this paper lies in formulating the nonperspective terrain navigation as an inverse problem of continuously deforming a 3D terrain surface from the 2D screen arrangement of its associated geographical landmarks. The present approach provides a perceptually reasonable compromise between the navigation clarity and visual realism where the corresponding nonperspective view is fully augmented by assigning appropriate textures and shading effects to the terrain surface according to its geometry. An eye tracking experiment is conducted to prove that the present approach actually exhibits visually-pleasing navigation frames while users can clearly recognize the shape of the driving route without occlusion, together with the spatial configuration of geographical landmarks in its neighborhood	Takahashi, S.;Yoshida, K.;Shimada, K.;Nishita, T.	Tokyo Univ., Chiba|c|;;;	37280401000;37826572100;37324632500;37267968100
	InfoVis+SciVis	Sept.-Oct. 2006	Interactive Visualization of Intercluster Galaxy Structures in the Horologium-Reticulum Supercluster	10.1109/TVCG.2006.155	http://dx.doi.org/10.1109/TVCG.2006.155	1149	1156	4015476	astronomy computing;clusters of galaxies;cosmology;data visualisation	2D projection techniques;3D galaxy positions;3D perception;GyVe interactive visualization tool;astronomical RA-DEC-cz coordinate system;geometrical distinct glyphs;horologium-reticulum supercluster;interactive user control;interactive visualization;intercluster galaxy structures;sparse three-dimensional point data;statistical techniques;torsional rocking	Astronomy;Collaboration;Collaborative tools;Computer science;Control systems;Data visualization;Large-scale systems;Shape;Space technology;Spectroscopy	Sparse point visualization;astronomy;cosmology	We present GyVe, an interactive visualization tool for understanding structure in sparse three-dimensional (3D) point data. The scientific goal driving the tool's development is to determine the presence of filaments and voids as defined by inferred 3D galaxy positions within the horologium-reticulum supercluster (HRS). GyVe provides visualization techniques tailored to examine structures defined by the intercluster galaxies. Specific techniques include: interactive user control to move between a global overview and local viewpoints, labelled axes and curved drop lines to indicate positions in the astronomical RA-DEC-cz coordinate system, torsional rocking and stereo to enhance 3D perception, and geometrically distinct glyphs to show potential correlation between intercluster galaxies and known clusters. We discuss the rationale for each design decision and review the success of the techniques in accomplishing the scientific goals. In practice, GyVe has been useful for gaining intuition about structures that were difficult to perceive with 2D projection techniques alone. For example, during their initial session with GyVe, our collaborators quickly confirmed scientific conclusions regarding the large-scale structure of the HRS previously obtained over months of study with 2D projections and statistical techniques. Further use of GyVe revealed the spherical shape of voids and showed that a presumed filament was actually two disconnected structures	Miller, J.;Quammen, C.W.;Fleenor, M.C.	Dept of Comput. Sci., North Carolina Univ., Chapel Hill, NC|c|;;	37830883100;37828726400;37828722500
