	InfoVis+SciVis	Sept.-Oct. 2006	A Pipeline for Computer Aided Polyp Detection	10.1109/TVCG.2006.112	http://dx.doi.org/10.1109/TVCG.2006.112	861	868	4015440	computerised tomography;conformal mapping;feature extraction;image texture;medical image processing;pattern clustering;rendering (computer graphics);virtual reality	2D clustering method;2D pattern recognition problem;computer aided polyp detection;conformal colon flattening;conformal mapping;image texture;interactive virtual colonoscopy system;shape analysis;translucent electronic biopsy transfer function;volume rendering;volumetric ray casting algorithm;volumetric texture feature	Colon;Colonic polyps;Colonography;Image converters;Image segmentation;Pattern recognition;Pipelines;Rendering (computer graphics);Shape;Virtual colonoscopy	Computer Aided Detection;Texture Analysis;Virtual Colonoscopy;Volume Rendering	We present a novel pipeline for computer-aided detection (CAD) of colonic polyps by integrating texture and shape analysis with volume rendering and conformal colon flattening. Using our automatic method, the 3D polyp detection problem is converted into a 2D pattern recognition problem. The colon surface is first segmented and extracted from the CT data set of the patient's abdomen, which is then mapped to a 2D rectangle using conformal mapping. This flattened image is rendered using a direct volume rendering technique with a translucent electronic biopsy transfer function. The polyps are detected by a 2D clustering method on the flattened image. The false positives are further reduced by analyzing the volumetric shape and texture features. Compared with shape based methods, our method is much more efficient without the need of computing curvature and other shape parameters for the whole colon surface. The final detection results are stored in the 2D image, which can be easily incorporated into a virtual colonoscopy (VC) system to highlight the polyp locations. The extracted colon surface mesh can be used to accelerate the volumetric ray casting algorithm used to generate the VC endoscopic view. The proposed automatic CAD pipeline is incorporated into an interactive VC system, with a goal of helping radiologists detect polyps faster and with higher accuracy	Hong, W.;Feng Qiu;Kaufman, A.	Dept. of Comput. Sci., Stony Brook Univ., NY|c|;;	37277099300;37416126400;37268052800
	InfoVis+SciVis	Sept.-Oct. 2006	Full Body Virtual Autopsies using a State-of-the-art Volume Rendering Pipeline	10.1109/TVCG.2006.146	http://dx.doi.org/10.1109/TVCG.2006.146	869	876	4015441	computerised tomography;data visualisation;image resolution;medical image processing;rendering (computer graphics);virtual reality	CT-scan;GPU-based raycaster;data management component;data reduction;forensic medicine;full body virtual autopsy;interactive 3D visualization;multiresolution rendering technique;transfer function;volume rendering pipeline	Autopsy;Biomedical imaging;Cadaver;Computed tomography;Data visualization;Forensics;Large-scale systems;Medical diagnostic imaging;Pipelines;Transfer functions	Forensics;autopsies;large scale data.;medical visualization;volume rendering	This paper presents a procedure for virtual autopsies based on interactive 3D visualizations of large scale, high resolution data from CT-scans of human cadavers. The procedure is described using examples from forensic medicine and the added value and future potential of virtual autopsies is shown from a medical and forensic perspective. Based on the technical demands of the procedure state-of-the-art volume rendering techniques are applied and refined to enable real-time, full body virtual autopsies involving gigabyte sized data on standard GPUs. The techniques applied include transfer function based data reduction using level-of-detail selection and multi-resolution rendering techniques. The paper also describes a data management component for large, out-of-core data sets and an extension to the GPU-based raycaster for efficient dual TF rendering. Detailed benchmarks of the pipeline are presented using data sets from forensic cases	Ljung, P.;Winskog, C.;Persson, A.;Lundstrom, C.;Ynnerman, A.	Div. for Visual Inf. Technol. & Applications, Linkoping Univ.|c|;;;;	37284208400;37828700500;37604521200;37284209100;37284192000
	InfoVis+SciVis	Sept.-Oct. 2006	Real-Time Illustration of Vascular Structures	10.1109/TVCG.2006.172	http://dx.doi.org/10.1109/TVCG.2006.172	877	884	4015442	blood vessels;data visualisation;rendering (computer graphics)	GPU-accelerated shadow-like depth indicator;GPU-based hatching algorithm;real-time vascular visualization method;rendering technique;static monoscopic 3D visualization;tubular structure;vascular structure	Absorption;Liver;Medical treatment;Reflection;Shape;Surface morphology;Surgery;Topology;Veins;Visualization	Vessel visualization;evaluation;functional realism;illustrative rendering;spatial perception	We present real-time vascular visualization methods, which extend on illustrative rendering techniques to particularly accentuate spatial depth and to improve the perceptive separation of important vascular properties such as branching level and supply area. The resulting visualization can and has already been used for direct projection on a patient's organ in the operation theater where the varying absorption and reflection characteristics of the surface limit the use of color. The important contributions of our work are a GPU-based hatching algorithm for complex tubular structures that emphasizes shape and depth as well as GPU-accelerated shadow-like depth indicators, which enable reliable comparisons of depth distances in a static monoscopic 3D visualization. In addition, we verify the expressiveness of our illustration methods in a large, quantitative study with 160 subjects	Ritter, F.;Hansen, C.;Dicken, V.;Konrad, O.;Preim, B.;Peitgen, H.-O.	MeVis GmbH|c|;;;;;	37645939800;37824134900;37828698600;37828698700;37424645300;37442956900
	InfoVis+SciVis	Sept.-Oct. 2006	Lines of Curvature for Polyp Detection in Virtual Colonoscopy	10.1109/TVCG.2006.158	http://dx.doi.org/10.1109/TVCG.2006.158	885	892	4015443	computational geometry;data visualisation;feature extraction;medical image processing;mesh generation;rendering (computer graphics);virtual reality	3D volume data;colonic polyp detection;computer-aided diagnosis;curvature line;data visualization;false-positive detection;feature detection;rendering technique;triangular surface meshes;virtual colonoscopy	Biomedical imaging;Cancer;Colon;Colonic polyps;Colonography;Computer aided diagnosis;Data visualization;Medical diagnostic imaging;Shape;Virtual colonoscopy	Medical visualization;implicit surface.;line of curvature;polyp detection;virtual colonoscopy	Computer-aided diagnosis (CAD) is a helpful addition to laborious visual inspection for preselection of suspected colonic polyps in virtual colonoscopy. Most of the previous work on automatic polyp detection makes use of indicators based on the scalar curvature of the colon wall and can result in many false-positive detections. Our work tries to reduce the number of false-positive detections in the preselection of polyp candidates. Polyp surface shape can be characterized and visualized using lines of curvature. In this paper, we describe techniques for generating and rendering lines of curvature on surfaces and we show that these lines can be used as part of a polyp detection approach. We have adapted existing approaches on explicit triangular surface meshes, and developed a new algorithm on implicit surfaces embedded in 3D volume data. The visualization of shaded colonic surfaces can be enhanced by rendering the derived lines of curvature on these surfaces. Features strongly correlated with true-positive detections were calculated on lines of curvature and used for the polyp candidate selection. We studied the performance of these features on 5 data sets that included 331 pre-detected candidates, of which 50 sites were true polyps. The winding angle had a significant discriminating power for true-positive detections, which was demonstrated by a Wilcoxon rank sum test with p<0.001. The median winding angle and inter-quartile range (IQR) for true polyps were 7.817 and 6.770-9.288 compared to 2.954 and 1.995-3.749 for false-positive detections	Zhao, L.;Botha, C.P.;Bescos, J.O.;Truyen, R.;Vos, F.M.;Post, F.H.	Data Visualization Group, Delft Univ. of Technol.|c|;;;;;	37834977900;37373834100;37591606800;37394318300;37271678400;37295045800
	InfoVis+SciVis	Sept.-Oct. 2006	Outlier-Preserving Focus+Context Visualization in Parallel Coordinates	10.1109/TVCG.2006.170	http://dx.doi.org/10.1109/TVCG.2006.170	893	900	4015444	data structures;data visualisation;feature extraction;rendering (computer graphics)	context visualization;data abstraction;data representation;focus visualization;outlier detection;output-oriented visualization approach;parallel coordinate;rendering technique;small-scale feature detection	Computer vision;Concurrent computing;Costs;Data visualization;Humans;Information processing;Jamming;Multidimensional systems;Navigation;Visual system	Parallel coordinates;focus+context visualization;large data visualization.;outliers & trends	Focus+context visualization integrates a visually accentuated representation of selected data items in focus (more details, more opacity, etc.) with a visually deemphasized representation of the rest of the data, i.e., the context. The role of context visualization is to provide an overview of the data for improved user orientation and improved navigation. A good overview comprises the representation of both outliers and trends. Up to now, however, context visualization not really treated outliers sufficiently. In this paper we present a new approach to focus+context visualization in parallel coordinates which is truthful to outliers in the sense that small-scale features are detected before visualization and then treated specially during context visualization. Generally, we present a solution which enables context visualization at several levels of abstraction, both for the representation of outliers and trends. We introduce outlier detection and context generation to parallel coordinates on the basis of a binned data representation. This leads to an output-oriented visualization approach which means that only those parts of the visualization process are executed which actually affect the final rendering. Accordingly, the performance of this solution is much more dependent on the visualization size than on the data size which makes it especially interesting for large datasets. Previous approaches are outperformed, the new solution was successfully applied to datasets with up to 3 million data records and up to 50 dimensions	Novotny, M.;Hauser, H.	Comenius Univ., Bratislava|c|;	37823192400;37274158800
	InfoVis+SciVis	Sept.-Oct. 2006	Composite Rectilinear Deformation for Stretch and Squish Navigation	10.1109/TVCG.2006.127	http://dx.doi.org/10.1109/TVCG.2006.127	901	908	4015445	data visualisation;rendering (computer graphics)	composite rectilinear deformation;information visualization;real-time rendering;rubber sheet navigation;screen-space location;squish navigation;stretch navigation	Cameras;Computer science;Displays;Graphics;History;Layout;Navigation;Pipelines;Rubber;Visualization	Focus+Context;information visualization;navigation.;real time rendering	We present the first scalable algorithm that supports the composition of successive rectilinear deformations. Earlier systems that provided stretch and squish navigation could only handle small datasets. More recent work featuring rubber sheet navigation for large datasets has focused on rendering and on application-specific issues. However, no algorithm has yet been presented for carrying out such navigation methods; our paper addresses this problem. For maximum flexibility with large datasets, a stretch and squish navigation algorithm should allow for millions of potentially deformable regions. However, typical usage only changes the extents of a small subset k of these n regions at a time. The challenge is to avoid computations that are linear in n, because a single deformation can affect the absolute screen-space location of every deformable region. We provide an O(klogn) algorithm that supports any application that can lay out a dataset on a generic grid, and show an implementation that allows navigation of trees and gene sequences with millions of items in sub-millisecond time	Slack, J.;Munzner, T.	Dept. of Comput. Sci., British Columbia Univ., Vancouver, BC|c|;	37561415800;37349490300
	InfoVis+SciVis	Sept.-Oct. 2006	Multi-variate, Time Varying, and Comparative Visualization with Contextual Cues	10.1109/TVCG.2006.164	http://dx.doi.org/10.1109/TVCG.2006.164	909	916	4015446	data visualisation;rendering (computer graphics)	contextual information;data visualization;multivariate time-varying comparative visualization;numerical operation;rendering technique;volume shader;volume tree	Animation;Computer science;Data visualization;Filling;Humans;Switches;Transfer functions	comparative;focus + context;multi-variate;time-varying	Time-varying, multi-variate, and comparative data sets are not easily visualized due to the amount of data that is presented to the user at once. By combining several volumes together with different operators into one visualized volume, the user is able to compare values from different data sets in space over time, run, or field without having to mentally switch between different renderings of individual data sets. In this paper, we propose using a volume shader where the user is given the ability to easily select and operate on many data volumes to create comparison relationships. The user specifies an expression with set and numerical operations and her data to see relationships between data fields. Furthermore, we render the contextual information of the volume shader by converting it to a volume tree. We visualize the different levels and nodes of the volume tree so that the user can see the results of suboperations. This gives the user a deeper understanding of the final visualization, by seeing how the parts of the whole are operationally constructed	Woodring, J.;Han-Wei Shen	Dept. of Comput. Sci. & Eng., Ohio State Univ., Columbus, OH|c|;	37542815100;37279493500
	InfoVis+SciVis	Sept.-Oct. 2006	Multifield-Graphs: An Approach to Visualizing Correlations in Multifield Scalar Data	10.1109/TVCG.2006.165	http://dx.doi.org/10.1109/TVCG.2006.165	917	924	4015447	data visualisation;rendering (computer graphics)	3D multifield scalar data;3D volume visualization technique;correlation field;data visualization;multifield-graph method	Computational modeling;Computer science;Computer simulation;Data visualization;Tensile stress	Visualization;correlation;multifield	We present an approach to visualizing correlations in 3D multifield scalar data. The core of our approach is the computation of correlation fields, which are scalar fields containing the local correlations of subsets of the multiple fields. While the visualization of the correlation fields can be done using standard 3D volume visualization techniques, their huge number makes selection and handling a challenge. We introduce the multifield-graph to give an overview of which multiple fields correlate and to show the strength of their correlation. This information guides the selection of informative correlation fields for visualization. We use our approach to visually analyze a number of real and synthetic multifield datasets	Sauber, N.;Theisel, H.;Seidel, H.-P.	Max-Planck-Inst. fur Inf., Saarbrucken|c|;;	37550815800;37266875400;37271851300
	InfoVis+SciVis	Sept.-Oct. 2006	Saliency-guided Enhancement for Volume Visualization	10.1109/TVCG.2006.174	http://dx.doi.org/10.1109/TVCG.2006.174	925	932	4015448	data visualisation;rendering (computer graphics)	saliency-guided enhancement;visual-saliency-based operator;volume rendering;volume visualization	Art;Biomedical imaging;Data visualization;Geometry;Humans;Large-scale systems;Mouth;Optical attenuators;Pipelines;Transfer functions	Saliency;non-photorealistic rendering;perceptual enhancement;visual attention;volume rendering	Recent research in visual saliency has established a computational measure of perceptual importance. In this paper we present a visual-saliency-based operator to enhance selected regions of a volume. We show how we use such an operator on a user-specified saliency field to compute an emphasis field. We further discuss how the emphasis field can be integrated into the visualization pipeline through its modifications of regional luminance and chrominance. Finally, we validate our work using an eye-tracking-based user study and show that our new saliency enhancement operator is more effective at eliciting viewer attention than the traditional Gaussian enhancement operator	Youngmin Kim;Varshney, A.	Maryland Univ., College Park, MD|c|;	37836140000;37282560200
	InfoVis+SciVis	Sept.-Oct. 2006	Importance-Driven Focus of Attention	10.1109/TVCG.2006.152	http://dx.doi.org/10.1109/TVCG.2006.152	933	940	4015449	data visualisation;focusing	automatic feature focusing;characteristic viewpoint estimation;cut-away view incorporation;data visualisation;expressive feature view;importance distribution;importance-driven attention focus;information-theoretic framework;mutual information measure;visual emphasis;volumetric data set	Application software;Automatic control;Biomedical imaging;Computed tomography;Data visualization;Focusing;Humans;Medical diagnostic imaging;Mutual information;Workstations	Illustrative visualization;characteristic viewpoint estimation;focus+context techniques;interacting with volumetric datasets;volume visualization	This paper introduces a concept for automatic focusing on features within a volumetric data set. The user selects a focus, i.e., object of interest, from a set of pre-defined features. Our system automatically determines the most expressive view on this feature. A characteristic viewpoint is estimated by a novel information-theoretic framework which is based on the mutual information measure. Viewpoints change smoothly by switching the focus from one feature to another one. This mechanism is controlled by changes in the importance distribution among features in the volume. The highest importance is assigned to the feature in focus. Apart from viewpoint selection, the focusing mechanism also steers visual emphasis by assigning a visually more prominent representation. To allow a clear view on features that are normally occluded by other parts of the volume, the focusing for example incorporates cut-away views	Viola, I.;Feixas, M.;Sbert, M.;Groller, M.E.	Inst. of Comput. Graphics & Algorithms, Vienna Univ. of Technol.|c|;;;	37282726800;37426689600;37396572900;37282552200
	InfoVis+SciVis	Sept.-Oct. 2006	ClearView: An Interactive Context Preserving Hotspot Visualization Technique	10.1109/TVCG.2006.124	http://dx.doi.org/10.1109/TVCG.2006.124	941	948	4015450	data visualisation;focusing;image resolution;rendering (computer graphics);user interfaces	ClearView;complex volumetric data;context information focus;image information;interactive context preserving hotspot visualization technique;mental exercise;point-and-click interface;texture-based volume ray-casting;visual clutter	Computer graphics;Context;Data visualization;Focusing;Information filtering;Information filters;Navigation;Rendering (computer graphics);Shape;Topology	GPU rendering;Terms¿Focus & Context;volume raycasting	Volume rendered imagery often includes a barrage of 3D information like shape, appearance and topology of complex structures, and it thus quickly overwhelms the user. In particular, when focusing on a specific region a user cannot observe the relationship between various structures unless he has a mental picture of the entire data. In this paper we present ClearView, a GPU-based, interactive framework for texture-based volume ray-casting that allows users which do not have the visualization skills for this mental exercise to quickly obtain a picture of the data in a very intuitive and user-friendly way. ClearView is designed to enable the user to focus on particular areas in the data while preserving context information without visual clutter. ClearView does not require additional feature volumes as it derives any features in the data from image information only. A simple point-and-click interface enables the user to interactively highlight structures in the data. ClearView provides an easy to use interface to complex volumetric data as it only uses transparency in combination with a few specific shaders to convey focus and context information	Kruger, J.;Schneider, J.;Westermann, R.	Comput. Graphics & Visualization Group, Technische Univ. Munchen|c|;;	37548560500;37560044500;37444424000
	InfoVis+SciVis	Sept.-Oct. 2006	Visualization Tools for Vorticity Transport Analysis in Incompressible Flow	10.1109/TVCG.2006.199	http://dx.doi.org/10.1109/TVCG.2006.199	949	956	4015451	computational fluid dynamics;data visualisation;flow visualisation;turbines;vortices	CFD simulations;computational fluid dynamics;convergence;explorative analysis;incompressible flow;meshing errors;quantitative analysis;simulation quality;upstream direction;visualization tools;vortex regions;vorticity equation;vorticity transport analysis;water turbines	Analytical models;Angular velocity;Computational fluid dynamics;Convergence;Equations;Performance analysis;Silver;Turbines;Turbomachinery;Visualization	Flow visualization;linked views.;unsteady flow;vorticity transport	Vortices are undesirable in many applications while indispensable in others. It is therefore of common interest to understand their mechanisms of creation. This paper aims at analyzing the transport of vorticity inside incompressible flow. The analysis is based on the vorticity equation and is performed along pathlines which are typically started in upstream direction from vortex regions. Different methods for the quantitative and explorative analysis of vorticity transport are presented and applied to CFD simulations of water turbines. Simulation quality is accounted for by including the errors of meshing and convergence into analysis and visualization. The obtained results are discussed and interpretations with respect to engineering questions are given	Sadlo, F.;Peikert, R.;Sick, M.	Comput. Sci. Dept., ETH Zurich|c|;;	37282541900;37282541100;37828727500
	InfoVis+SciVis	Sept.-Oct. 2006	Vortex Visualization for Practical Engineering Applications	10.1109/TVCG.2006.201	http://dx.doi.org/10.1109/TVCG.2006.201	957	964	4015452	computational fluid dynamics;data visualisation;external flows;feature extraction;flow visualisation;mesh generation;missiles;pattern clustering;vortices	complex vortical flows;core line extraction technique;feature-based vortex detection;k-means clustering;large computational fluid dynamics;missile flow field;practical engineering applications;scalar fields;serrated wing;simulation data sets;unstructured meshes;vortex visualization technique	Computational fluid dynamics;Computational modeling;Computer vision;Data mining;Data visualization;Geometry;Large-scale systems;Missiles;Spinning;Topology	Vortex detection;feature mining;vortex visualization	In order to understand complex vortical flows in large data sets, we must be able to detect and visualize vortices in an automated fashion. In this paper, we present a feature-based vortex detection and visualization technique that is appropriate for large computational fluid dynamics data sets computed on unstructured meshes. In particular, we focus on the application of this technique to visualization of the flow over a serrated wing and the flow field around a spinning missile with dithering canards. We have developed a core line extraction technique based on the observation that vortex cores coincide with local extrema in certain scalar fields. We also have developed a novel technique to handle complex vortex topology that is based on k-means clustering. These techniques facilitate visualization of vortices in simulation data that may not be optimally resolved or sampled. Results are included that highlight the strengths and weaknesses of our approach. We conclude by describing how our approach can be improved to enhance robustness and expand its range of applicability	Jankun-Kelly, M.;Jiang, M.;Thompson, D.;Machiraju, R.	Computational Simulation & Design Center, Mississippi State Univ., MS|c|;;;	37828704100;37826582200;38181602100;37269516700
