	VAST	Dec. 2012	Semantic Interaction for Sensemaking: Inferring Analytical Reasoning for Model Steering	10.1109/TVCG.2012.260	http://dx.doi.org/10.1109/TVCG.2012.260	2879	2888	6327294	data visualisation;inference mechanisms	ForceSPIRE;analytical reasoning;clustering model;cognitively demanding task;expressive interactions;human intuition;keyword weighting;mathematical models;model steering;parametric modifications;semantic interaction;sensemaking;spatially clustering data;visual analytic prototype;visual analytic tools;visualization	Analytical models;Mathematical model;Semantics;User interfaces;Visual analytics	User Interaction;analytic reasoning;sensemaking;visual analytics;visualization	Visual analytic tools aim to support the cognitively demanding task of sensemaking. Their success often depends on the ability to leverage capabilities of mathematical models, visualization, and human intuition through flexible, usable, and expressive interactions. Spatially clustering data is one effective metaphor for users to explore similarity and relationships between information, adjusting the weighting of dimensions or characteristics of the dataset to observe the change in the spatial layout. Semantic interaction is an approach to user interaction in such spatializations that couples these parametric modifications of the clustering model with users' analytic operations on the data (e.g., direct document movement in the spatialization, highlighting text, search, etc.). In this paper, we present results of a user study exploring the ability of semantic interaction in a visual analytic prototype, ForceSPIRE, to support sensemaking. We found that semantic interaction captures the analytical reasoning of the user through keyword weighting, and aids the user in co-creating a spatialization based on the user's reasoning and intuition.	Endert, A.;Fiaux, P.;North, C.	;;	37681759500;38489240900;37419565900
	VAST	Dec. 2012	Visual Analytics Methodology for Eye Movement Studies	10.1109/TVCG.2012.276	http://dx.doi.org/10.1109/TVCG.2012.276	2889	2898	6327295	data visualisation;eye;knowledge acquisition;user interfaces	empirical evaluation;eye movement analysis;eye movement study;eye tracking data;geographic movement data;knowledge extraction;scanpaths;task analysis;viewing behaviors;visual analytics methodology;visual displays evaluation;visual interfaces	Data visualization;Eye;Standards;Tracking;Trajectory;Visual analytics	Visual analytics;eye tracking;movement data;trajectory analysis	Eye movement analysis is gaining popularity as a tool for evaluation of visual displays and interfaces. However, the existing methods and tools for analyzing eye movements and scanpaths are limited in terms of the tasks they can support and effectiveness for large data and data with high variation. We have performed an extensive empirical evaluation of a broad range of visual analytics methods used in analysis of geographic movement data. The methods have been tested for the applicability to eye tracking data and the capability to extract useful knowledge about users' viewing behaviors. This allowed us to select the suitable methods and match them to possible analysis tasks they can support. The paper describes how the methods work in application to eye tracking data and provides guidelines for method selection depending on the analysis tasks.	Andrienko, G.;Andrienko, N.;Burch, M.;Weiskopf, D.	;;;	37283047100;37283047700;37586953400;37268045000
	VAST	Dec. 2012	A Visual Analytics Approach to Multiscale Exploration of Environmental Time Series	10.1109/TVCG.2012.191	http://dx.doi.org/10.1109/TVCG.2012.191	2899	2907	6327296	data visualisation;environmental science computing;interactive systems;matrix algebra;pattern recognition;statistical analysis;time series	environmental science;environmental system dynamics;environmental time series;interactive exploration;interesting temporal pattern detection;matrix visualization;multiscale exploration;numerical time series;statistical value;visual analytics approach;visual identification	Data visualization;Earth;Entropy;Meteorology;Time series analysis;Visual analytics	Time series analysis;multiscale visualization;visual analytics	We present a Visual Analytics approach that addresses the detection of interesting patterns in numerical time series, specifically from environmental sciences. Crucial for the detection of interesting temporal patterns are the time scale and the starting points one is looking at. Our approach makes no assumption about time scale and starting position of temporal patterns and consists of three main steps: an algorithm to compute statistical values for all possible time scales and starting positions of intervals, visual identification of potentially interesting patterns in a matrix visualization, and interactive exploration of detected patterns. We demonstrate the utility of this approach in two scientific scenarios and explain how it allowed scientists to gain new insight into the dynamics of environmental systems.	Sips, M.;Kothur, P.;Unger, A.;Hege, H.-C.;Dransch, D.	German Res. Center for Geosci. GFZ, Germany|c|;;;;	37827860500;38490165500;37628385900;37282272000;38490186800
	VAST	Dec. 2012	The User Puzzle&amp;#8212;Explaining the Interaction with Visual Analytics Systems	10.1109/TVCG.2012.273	http://dx.doi.org/10.1109/TVCG.2012.273	2908	2916	6327297	cognition;data visualisation;human computer interaction;psychology	HCI;analytical procedures;human reasoning;psychology;user puzzle;visual analytics systems	Cognition;Human factors;Problem-solving;Psychology;Visual analytics	Cognitive theory;interaction design;problem solving;reasoning;visual knowledge discovery	Visual analytics emphasizes the interplay between visualization, analytical procedures performed by computers and human perceptual and cognitive activities. Human reasoning is an important element in this context. There are several theories in psychology and HCI explaining open-ended and exploratory reasoning. Five of these theories (sensemaking theories, gestalt theories, distributed cognition, graph comprehension theories and skill-rule-knowledge models) are described in this paper. We discuss their relevance for visual analytics. In order to do this more systematically, we developed a schema of categories relevant for visual analytics research and evaluation. All these theories have strengths but also weaknesses in explaining interaction with visual analytics systems. A possibility to overcome the weaknesses would be to combine two or more of these theories.	Pohl, M.;Smuc, M.;Mayr, E.	Vienna Univ. of Technol., Vienna, Austria|c|;;	37560816000;37646291700;37624360500
	VAST	Dec. 2012	Enterprise Data Analysis and Visualization: An Interview Study	10.1109/TVCG.2012.219	http://dx.doi.org/10.1109/TVCG.2012.219	2917	2926	6327298	business data processing;data analysis;data visualisation;decision making;organisational aspects	business decision;customer engagement;data analysts;data visualization;enterprise data analysis;finance;fraud combatting;healthcare;industrial data analysis;marketing;operation streamlining;organizational context;organizational feature;outstanding challenge;production improvement;recurring pain point;retail;semistructured interview;social context;visual analysis research;visual analytic tool adoption	Collaboration;Computer hacking;Data visualization;Distributed databases;Organizations	Data;analysis;enterprise;visualization	Organizations rely on data analysts to model customer engagement, streamline operations, improve production, inform business decisions, and combat fraud. Though numerous analysis and visualization tools have been built to improve the scale and efficiency at which analysts can work, there has been little research on how analysis takes place within the social and organizational context of companies. To better understand the enterprise analysts' ecosystem, we conducted semi-structured interviews with 35 data analysts from 25 organizations across a variety of sectors, including healthcare, retail, marketing and finance. Based on our interview data, we characterize the process of industrial data analysis and document how organizational features of an enterprise impact it. We describe recurring pain points, outstanding challenges, and barriers to adoption for visual analytic tools. Finally, we discuss design implications and opportunities for visual analysis research.	Kandel, S.;Paepcke, A.;Hellerstein, J.M.;Heer, J.	Stanford Univ., Stanford, CA, USA|c|;;;	38490119500;37282105600;38183421000;37550791300
	VAST	14-19 Oct. 2012	Visual cluster exploration of web clickstream data	10.1109/VAST.2012.6400494	http://dx.doi.org/10.1109/VAST.2012.6400494	3	12	6400494	Internet;Markov processes;data analysis;data visualisation;electronic commerce;pattern clustering;self-organising feature maps;user interfaces	Markov chain models;Web clickstream data;clickstream clusters;e-commerce companies;eBay;intuitive user interface;self-organizing map;user behavior patterns;visual analytics system;visual cluster exploration	Data models;Data visualization;Hidden Markov models;Layout;Markov processes;Prototypes;Visualization		Web clickstream data are routinely collected to study how users browse the web or use a service. It is clear that the ability to recognize and summarize user behavior patterns from such data is valuable to e-commerce companies. In this paper, we introduce a visual analytics system to explore the various user behavior patterns reflected by distinct clickstream clusters. In a practical analysis scenario, the system first presents an overview of clickstream clusters using a Self-Organizing Map with Markov chain models. Then the analyst can interactively explore the clusters through an intuitive user interface. He can either obtain summarization of a selected group of data or further refine the clustering result. We evaluated our system using two different datasets from eBay. Analysts who were working on the same data have confirmed the system's effectiveness in extracting user behavior patterns from complex datasets and enhancing their ability to reason.			
	VAST	14-19 Oct. 2012	An adaptive parameter space-filling algorithm for highly interactive cluster exploration	10.1109/VAST.2012.6400493	http://dx.doi.org/10.1109/VAST.2012.6400493	13	22	6400493	cache storage;data visualisation;human computer interaction;pattern clustering;query processing;storage management	K means clustering;LRU caching;Mesonet meteorological data;adaptive parameter space-filling algorithm;best-effort clustering;continuous interactive response time;dynamic query visualization;exact-range clustering;heuristic prefetching technique;interactive cluster exploration;motion parallax;multidimensional clustering;multidimensional data;nearest neighbor calculation;one-dimensional filtering lens;partial query;query computation;time series data;two-dimensional parameter space;user interaction pattern;visual benefit;visualization system;visualization tool	Algorithm design and analysis;Clustering algorithms;Data visualization;Lenses;Prefetching;Time series analysis;Visualization	D.2.2 [Software Engineering]: Design Tools and Techniques — [User Interfaces];H.2.3 [Information Systems]: Database Management — [Languages];H.5.2 [Information Systems]: Information Interfaces and Presentation — [User Interfaces]	For a user to perceive continuous interactive response time in a visualization tool, the rule of thumb is that it must process, deliver, and display rendered results for any given interaction in under 100 milliseconds. In many visualization systems, successive interactions trigger independent queries and caching of results. Consequently, computationally expensive queries like multidimensional clustering cannot keep up with rapid sequences of interactions, precluding visual benefits such as motion parallax. In this paper, we describe a heuristic prefetching technique to improve the interactive response time of KMeans clustering in dynamic query visualizations of multidimensional data. We address the tradeoff between high interaction and intense query computation by observing how related interactions on overlapping data subsets produce similar clustering results, and characterizing these similarities within a parameter space of interaction. We focus on the two-dimensional parameter space defined by the minimum and maximum values of a time range manipulated by dragging and stretching a one-dimensional filtering lens over a plot of time series data. Using calculation of nearest neighbors of interaction points in parameter space, we reuse partial query results from prior interaction sequences to calculate both an immediate best-effort clustering result and to schedule calculation of an exact result. The method adapts to user interaction patterns in the parameter space by reprioritizing the interaction neighbors of visited points in the parameter space. A performance study on Mesonet meteorological data demonstrates that the method is a significant improvement over the baseline scheme in which interaction triggers on-demand, exact-range clustering with LRU caching. We also present initial evidence that approximate, temporary clustering results are sufficiently accurate (compared to exact results) to convey useful cluster structure during rapid and protracted interaction.	Ahmed, Z.	Sch. of Comput. Sci. &amp; Center for Spatial Anal., Univ. of Oklahoma, Norman, OK, USA|c|	
	VAST	14-19 Oct. 2012	Inter-active learning of ad-hoc classifiers for video visual analytics	10.1109/VAST.2012.6400492	http://dx.doi.org/10.1109/VAST.2012.6400492	23	32	6400492	cognition;data visualisation;inference mechanisms;information filtering;information filters;learning (artificial intelligence);pattern classification;training;video retrieval	ad-hoc classifier training process visual feedback;analytical reasoning process;classifier learning;data annotation quality;data labeling queries;data visualization;human expert background knowledge;information filters;inter-active learning;time constraints;user expertise;user mental model;video visual analytics	Analytical models;Data models;Data visualization;Humans;Labeling;Training;Visual analytics	H.3.3 [Information Systems]: Information Storage and Retrieval — Information Search and Retrieval;I.2.6 [Computing Methodologies]: Artificial Intelligence — Learning	Learning of classifiers to be used as filters within the analytical reasoning process leads to new and aggravates existing challenges. Such classifiers are typically trained ad-hoc, with tight time constraints that affect the amount and the quality of annotation data and, thus, also the users' trust in the classifier trained. We approach the challenges of ad-hoc training by inter-active learning, which extends active learning by integrating human experts' background knowledge to greater extent. In contrast to active learning, not only does inter-active learning include the users' expertise by posing queries of data instances for labeling, but it also supports the users in comprehending the classifier model by visualization. Besides the annotation of manually or automatically selected data instances, users are empowered to directly adjust complex classifier models. Therefore, our model visualization facilitates the detection and correction of inconsistencies between the classifier model trained by examples and the user's mental model of the class definition. Visual feedback of the training process helps the users assess the performance of the classifier and, thus, build up trust in the filter created. We demonstrate the capabilities of inter-active learning in the domain of video visual analytics and compare its performance with the results of random sampling and uncertainty sampling of training sets.			
	VAST	14-19 Oct. 2012	A correlative analysis process in a visual analytics environment	10.1109/VAST.2012.6400491	http://dx.doi.org/10.1109/VAST.2012.6400491	33	42	6400491	data analysis;data visualisation;statistical analysis	Pearson product-moment correlation coefficient;correlative analysis process;multivariate datasets;spatiotemporal aggregation levels;spatiotemporal correlations;statistics;visual analytics environment	Correlation;Data visualization;Educational institutions;Market research;Spatiotemporal phenomena;Time series analysis;Visual analytics	Visual analytics;correlative analysis	Finding patterns and trends in spatial and temporal datasets has been a long studied problem in statistics and different domains of science. This paper presents a visual analytics approach for the interactive exploration and analysis of spatiotemporal correlations among multivariate datasets. Our approach enables users to discover correlations and explore potentially causal or predictive links at different spatiotemporal aggregation levels among the datasets, and allows them to understand the underlying statistical foundations that precede the analysis. Our technique utilizes the Pearson's product-moment correlation coefficient and factors in the lead or lag between different datasets to detect trends and periodic patterns amongst them.	Malik, A.	Purdue Univ., West Lafayette, IN, USA|c|	
	VAST	14-19 Oct. 2012	Visual pattern discovery using random projections	10.1109/VAST.2012.6400490	http://dx.doi.org/10.1109/VAST.2012.6400490	43	52	6400490	data mining;data visualisation;random processes	analytic multivariate visualization platform;binning projections;data analysis;feature subspaces;high-dimensional data spaces;low-dimensional projections;multidimensional spaces;projection pursuit index;random projections;score function optimization;visual pattern characterization;visual pattern discovery	Data mining;Data visualization;Indexes;Manifolds;Vectors;Visual analytics	High-dimensional Data;Random Projections	An essential element of exploratory data analysis is the use of revealing low-dimensional projections of high-dimensional data. Projection Pursuit has been an effective method for finding interesting low-dimensional projections of multidimensional spaces by optimizing a score function called a projection pursuit index. However, the technique is not scalable to high-dimensional spaces. Here, we introduce a novel method for discovering noteworthy views of high-dimensional data spaces by using binning and random projections. We define score functions, akin to projection pursuit indices, that characterize visual patterns of the low-dimensional projections that constitute feature subspaces. We also describe an analytic, multivariate visualization platform based on this algorithm that is scalable to extremely large problems.	Anand, A.	Dept. of Comput. Sci., Univ. of Illinois at Chicago, Chicago, IL, USA|c|	
	VAST	14-19 Oct. 2012	iLAMP: Exploring high-dimensional spacing through backward multidimensional projection	10.1109/VAST.2012.6400489	http://dx.doi.org/10.1109/VAST.2012.6400489	53	62	6400489	data visualisation	backward multidimensional projection;biology computing;coined iLAMP;computing power improvement;data complexity;data dimensionality;engineering computing;extrapolated data;flexible mechanisms;greatly augmenting data collection;high-dimensional spaces;high-dimensional spacing;interactive exploration technique;inverse linear affine multidimensional projection;mapping low-dimensional information;multidimensional datasets understanding;physics computing;planar domain;projection methods;scientific computing;scientific observation;technological advances	Data visualization;Measurement;Optimization;Robustness;Space exploration;Vectors;Visualization		Ever improving computing power and technological advances are greatly augmenting data collection and scientific observation. This has directly contributed to increased data complexity and dimensionality, motivating research of exploration techniques for multidimensional data. Consequently, a recent influx of work dedicated to techniques and tools that aid in understanding multidimensional datasets can be observed in many research fields, including biology, engineering, physics and scientific computing. While the effectiveness of existing techniques to analyze the structure and relationships of multidimensional data varies greatly, few techniques provide flexible mechanisms to simultaneously visualize and actively explore high-dimensional spaces. In this paper, we present an inverse linear affine multidimensional projection, coined iLAMP, that enables a novel interactive exploration technique for multidimensional data. iLAMP operates in reverse to traditional projection methods by mapping low-dimensional information into a high-dimensional space. This allows users to extrapolate instances of a multidimensional dataset while exploring a projection of the data to the planar domain. We present experimental results that validate iLAMP, measuring the quality and coherence of the extrapolated data; as well as demonstrate the utility of iLAMP to hypothesize the unexplored regions of a high-dimensional space.			
	VAST	14-19 Oct. 2012	Subspace search and visualization to make sense of alternative clusterings in high-dimensional data	10.1109/VAST.2012.6400488	http://dx.doi.org/10.1109/VAST.2012.6400488	63	72	6400488	data analysis;data reduction;data visualisation;pattern clustering;search problems	HD data space;HD input data space;cluster analysis;dimensionality reduction;explorative data analysis;high-dimensional data clusterings;high-dimensional data space;interestingness-guided subspace search algorithm;navigation facilities;subspace search;subspace similarity functions;subspace visualization;visual analysis;visual mappings;visual-interactive methods	Algorithm design and analysis;Clustering algorithms;Data visualization;Educational institutions;High definition video;Topology;Visualization	Display algorithms;H.2.8 [Database Applications]: Data mining;H.3.3 [Information Search and Retrieval]: Selection process;I.3.3 [Picture/Image Generation]	In explorative data analysis, the data under consideration often resides in a high-dimensional (HD) data space. Currently many methods are available to analyze this type of data. So far, proposed automatic approaches include dimensionality reduction and cluster analysis, whereby visual-interactive methods aim to provide effective visual mappings to show, relate, and navigate HD data. Furthermore, almost all of these methods conduct the analysis from a singular perspective, meaning that they consider the data in either the original HD data space, or a reduced version thereof. Additionally, HD data spaces often consist of combined features that measure different properties, in which case the particular relationships between the various properties may not be clear to the analysts a priori since it can only be revealed if appropriate feature combinations (subspaces) of the data are taken into consideration. Considering just a single subspace is, however, often not sufficient since different subspaces may show complementary, conjointly, or contradicting relations between data items. Useful information may consequently remain embedded in sets of subspaces of a given HD input data space. Relying on the notion of subspaces, we propose a novel method for the visual analysis of HD data in which we employ an interestingness-guided subspace search algorithm to detect a candidate set of subspaces. Based on appropriately defined subspace similarity functions, we visualize the subspaces and provide navigation facilities to interactively explore large sets of subspaces. Our approach allows users to effectively compare and relate subspaces with respect to involved dimensions and clusters of objects. We apply our approach to synthetic and real data sets. We thereby demonstrate its support for understanding HD data from different perspectives, effectively yielding a more complete view on HD data.	Tatu, A.	Univ. of Konstanz, Konstanz, Germany|c|	
