	SciVis+InfoVis+some VAST	Dec. 2012	An Adaptive Prediction-Based Approach to Lossless Compression of Floating-Point Volume Data	10.1109/TVCG.2012.194	http://dx.doi.org/10.1109/TVCG.2012.194	2295	2304	6327234	data compression;data visualisation;interpolation;natural sciences computing;polynomials	adaptive combined encoder;adaptive polynomial encoder;adaptive prediction;computer simulations;efficient visualization;floating-point values;interpolating polynomials;linear predictors;lossless compression;lossless floating-point compressors;medical floating-point volume data;observational measurements;polynomial predictors;prediction-based compression method;progressive representation;scientific data;scientific floating-point volume data;switched prediction scheme	Data models;Data visualization;Entropy coding;Floating-point arithmetic;Image coding;Polynomials	Volume compression;floating-point compression;lossless compression	In this work, we address the problem of lossless compression of scientific and medical floating-point volume data. We propose two prediction-based compression methods that share a common framework, which consists of a switched prediction scheme wherein the best predictor out of a preset group of linear predictors is selected. Such a scheme is able to adapt to different datasets as well as to varying statistics within the data. The first method, called APE (Adaptive Polynomial Encoder), uses a family of structured interpolating polynomials for prediction, while the second method, which we refer to as ACE (Adaptive Combined Encoder), combines predictors from previous work with the polynomial predictors to yield a more flexible, powerful encoder that is able to effectively decorrelate a wide range of data. In addition, in order to facilitate efficient visualization of compressed data, our scheme provides an option to partition floating-point values in such a way as to provide a progressive representation. We compare our two compressors to existing state-of-the-art lossless floating-point compressors for scientific data, with our data suite including both computer simulations and observational measurements. The results demonstrate that our polynomial predictor, APE, is comparable to previous approaches in terms of speed but achieves better compression rates on average. ACE, our combined predictor, while somewhat slower, is able to achieve the best compression rate on all datasets, with significantly better rates on most of the datasets.	Fout, N.;Kwan-Liu Ma	UC Davis, Davis, CA, USA|c|;	37945247900;37275869400
	SciVis+InfoVis+some VAST	Dec. 2012	On the Interpolation of Data with Normally Distributed Uncertainty for Visualization	10.1109/TVCG.2012.249	http://dx.doi.org/10.1109/TVCG.2012.249	2305	2314	6327235	Gaussian distribution;data visualisation;interpolation;learning (artificial intelligence)	Gaussian distributions;data interpolation;geostatistics;machine learning;normally distributed uncertainty;uncertain behavior;visualization purposes	Data models;Data visualization;Distributed databases;Gaussian processes;Interpolation;Random variables;Uncertainty	Gaussian process;interpolation;uncertainty	In many fields of science or engineering, we are confronted with uncertain data. For that reason, the visualization of uncertainty received a lot of attention, especially in recent years. In the majority of cases, Gaussian distributions are used to describe uncertain behavior, because they are able to model many phenomena encountered in science. Therefore, in most applications uncertain data is (or is assumed to be) Gaussian distributed. If such uncertain data is given on fixed positions, the question of interpolation arises for many visualization approaches. In this paper, we analyze the effects of the usual linear interpolation schemes for visualization of Gaussian distributed data. In addition, we demonstrate that methods known in geostatistics and machine learning have favorable properties for visualization purposes in this case.	Schlegel, S.;Korn, N.;Scheuermann, G.	Univ. of Leipzig, Leipzig, Germany|c|;;	38490141400;38489846500;37282574800
	SciVis+InfoVis+some VAST	Dec. 2012	Coherency-Based Curve Compression for High-Order Finite Element Model Visualization	10.1109/TVCG.2012.206	http://dx.doi.org/10.1109/TVCG.2012.206	2315	2324	6327236	data compression;data reduction;data visualisation;finite element analysis;ray tracing;rendering (computer graphics)	coherency-based curve compression;computational complexity;computes view-independent proxy rays;data reduction;decoupling method;engineering;geosciences;high-order basis functions;high-order finite element model visualization;interactive data exploration;interactive exploration;interactive rendering;life sciences;medicine;nonuniform grid;ray casting;regular grid structure;rendering stage;time-consuming simulations;uniformly distributed sample points;viewing ray;volumetric data sets;world-to-material space transformation	Computational modeling;Finite element methods;Rendering (computer graphics);Splines (mathematics)	Finite element visualization;GPU-based ray-casting	Finite element (FE) models are frequently used in engineering and life sciences within time-consuming simulations. In contrast with the regular grid structure facilitated by volumetric data sets, as used in medicine or geosciences, FE models are defined over a non-uniform grid. Elements can have curved faces and their interior can be defined through high-order basis functions, which pose additional challenges when visualizing these models. During ray-casting, the uniformly distributed sample points along each viewing ray must be transformed into the material space defined within each element. The computational complexity of this transformation makes a straightforward approach inadequate for interactive data exploration. In this paper, we introduce a novel coherency-based method which supports the interactive exploration of FE models by decoupling the expensive world-to-material space transformation from the rendering stage, thereby allowing it to be performed within a precomputation stage. Therefore, our approach computes view-independent proxy rays in material space, which are clustered to facilitate data reduction. During rendering, these proxy rays are accessed, and it becomes possible to visually analyze high-order FE models at interactive frame rates, even when they are time-varying or consist of multiple modalities. Within this paper, we provide the necessary background about the FE data, describe our decoupling method, and introduce our interactive rendering algorithm. Furthermore, we provide visual results and analyze the error introduced by the presented approach.	Bock, A.;Sunden, E.;Bingchen Liu;Wunsche, B.;Ropinski, T.	Sci. Visualization Group, Linkoping Univ., Linkoping, Sweden|c|;;;;	38489536800;38243026500;38489425700;37571592800;37295281400
	SciVis+InfoVis+some VAST	Dec. 2012	ElVis: A System for the Accurate and Interactive Visualization of High-Order Finite Element Solutions	10.1109/TVCG.2012.218	http://dx.doi.org/10.1109/TVCG.2012.218	2325	2334	6327237	Galerkin method;data visualisation;finite element analysis;graphics processing units;mathematics computing;parallel architectures;partial differential equations;ray tracing;rendering (computer graphics)	CUDA;ElVis;NVIDIA OptiX GPU-based ray-tracing engine;PDE;accelerated ray traversal;aerodynamic simulations;data visualization;debugging effort;element visualizer;high-order discontinuous Galerkin finite element solution;high-order finite element solution;high-order geometry;interactive visualization;linear function;linear method;linear primitive;open-source scientific visualization system;parallel evaluation;pixel-exact representation;pixel-exact visualization;visual artifact;visualization error minimisation;volume rendering	Data models;Finite element methods;Geometry;Isosurfaces;Polynomials;Rendering (computer graphics)	High-order finite elements;contours;cut surface extraction;discontinuous Galerkin;fluid flow simulation;isosurfaces;spectral/hp elements	This paper presents the Element Visualizer (ElVis), a new, open-source scientific visualization system for use with high-order finite element solutions to PDEs in three dimensions. This system is designed to minimize visualization errors of these types of fields by querying the underlying finite element basis functions (e.g., high-order polynomials) directly, leading to pixel-exact representations of solutions and geometry. The system interacts with simulation data through runtime plugins, which only require users to implement a handful of operations fundamental to finite element solvers. The data in turn can be visualized through the use of cut surfaces, contours, isosurfaces, and volume rendering. These visualization algorithms are implemented using NVIDIA's OptiX GPU-based ray-tracing engine, which provides accelerated ray traversal of the high-order geometry, and CUDA, which allows for effective parallel evaluation of the visualization algorithms. The direct interface between ElVis and the underlying data differentiates it from existing visualization tools. Current tools assume the underlying data is composed of linear primitives; high-order data must be interpolated with linear functions as a result. In this work, examples drawn from aerodynamic simulations-high-order discontinuous Galerkin finite element solutions of aerodynamic flows in particular-will demonstrate the superiority of ElVis' pixel-exact approach when compared with traditional linear-interpolation methods. Such methods can introduce a number of inaccuracies in the resulting visualization, making it unclear if visual artifacts are genuine to the solution data or if these artifacts are the result of interpolation errors. Linear methods additionally cannot properly visualize curved geometries (elements or boundaries) which can greatly inhibit developers' debugging efforts. As we will show, pixel-exact visualization exhibits none of these issues, removing the visualization scheme as a source of - ncertainty for engineers using ElVis.	Nelson, B.;Liu, E.;Kirby, R.M.;Haimes, R.	Sch. of Comput., Univ. of Utah, Salt Lake City, UT, USA|c|;;;	37557887400;38490364600;37275716100;37282898700
	SciVis+InfoVis+some VAST	Dec. 2012	Fuzzy Volume Rendering	10.1109/TVCG.2012.227	http://dx.doi.org/10.1109/TVCG.2012.227	2335	2344	6327238	data visualisation;fuzzy set theory;reliability;rendering (computer graphics);uncertainty handling	fuzzy transform;fuzzy volume rendering;possibility-based representation;reliable computing;self-validating computational model;uncertainty-aware rendering;visualization;volume data	Computational modeling;Data visualization;Rendering (computer graphics);Transforms;Uncertainty;Volume measurement	Uncertainty visualization;verifiable visualization;volume rendering	In order to assess the reliability of volume rendering, it is necessary to consider the uncertainty associated with the volume data and how it is propagated through the volume rendering algorithm, as well as the contribution to uncertainty from the rendering algorithm itself. In this work, we show how to apply concepts from the field of reliable computing in order to build a framework for management of uncertainty in volume rendering, with the result being a self-validating computational model to compute a posteriori uncertainty bounds. We begin by adopting a coherent, unifying possibility-based representation of uncertainty that is able to capture the various forms of uncertainty that appear in visualization, including variability, imprecision, and fuzziness. Next, we extend the concept of the fuzzy transform in order to derive rules for accumulation and propagation of uncertainty. This representation and propagation of uncertainty together constitute an automated framework for management of uncertainty in visualization, which we then apply to volume rendering. The result, which we call fuzzy volume rendering, is an uncertainty-aware rendering algorithm able to produce more complete depictions of the volume data, thereby allowing more reliable conclusions and informed decisions. Finally, we compare approaches for self-validated computation in volume rendering, demonstrating that our chosen method has the ability to handle complex uncertainty while maintaining efficiency.	Fout, N.;Kwan-Liu Ma	;	37945247900;37275869400
	SciVis+InfoVis+some VAST	Dec. 2012	Automatic Tuning of Spatially Varying Transfer Functions for Blood Vessel Visualization	10.1109/TVCG.2012.203	http://dx.doi.org/10.1109/TVCG.2012.203	2345	2354	6327239	blood vessels;computerised tomography;data visualisation;medical image processing;optimisation;rendering (computer graphics);transfer functions	CT angiography datasets;automatic tuning;blood stream;blood vessel visualization;blood vessels;clinical routine;computed tomography angiography;direct volume rendering;enhanced image contrast;image data;mixture concentration;optimization criterion;spatially varying transfer functions;vascular diseases;vesselness descriptor	Biomedical imaging;Blood vessels;Data visualization;Optimization;Rendering (computer graphics)	Direct volume rendering;transfer functions;vessel visualization	Computed Tomography Angiography (CTA) is commonly used in clinical routine for diagnosing vascular diseases. The procedure involves the injection of a contrast agent into the blood stream to increase the contrast between the blood vessels and the surrounding tissue in the image data. CTA is often visualized with Direct Volume Rendering (DVR) where the enhanced image contrast is important for the construction of Transfer Functions (TFs). For increased efficiency, clinical routine heavily relies on preset TFs to simplify the creation of such visualizations for a physician. In practice, however, TF presets often do not yield optimal images due to variations in mixture concentration of contrast agent in the blood stream. In this paper we propose an automatic, optimization-based method that shifts TF presets to account for general deviations and local variations of the intensity of contrast enhanced blood vessels. Some of the advantages of this method are the following. It computationally automates large parts of a process that is currently performed manually. It performs the TF shift locally and can thus optimize larger portions of the image than is possible with manual interaction. The method is based on a well known vesselness descriptor in the definition of the optimization criterion. The performance of the method is illustrated by clinically relevant CT angiography datasets displaying both improved structural overviews of vessel trees and improved adaption to local variations of contrast concentration.	Lathen, G.;Lindholm, S.;Lenz, R.;Persson, A.;Borga, M.	Center for Med. Image Sci. & Visualization (CMIV), Linkoping Univ., Linkoping, Sweden|c|;;;;	38187724100;37591265100;37270605100;37604521200;37294429200
	SciVis+InfoVis+some VAST	Dec. 2012	Hierarchical Exploration of Volumes Using Multilevel Segmentation of the Intensity-Gradient Histograms	10.1109/TVCG.2012.231	http://dx.doi.org/10.1109/TVCG.2012.231	2355	2363	6327240	data visualisation;gradient methods;image segmentation;information theory	data-driven coarse-to-fine hierarchy;exploration hierarchy;hierarchical volume exploration;histogram segmentation;information-theoretic measures;intensity-gradient 2D histogram;intensity-gradient histogram;normalized-cut multilevel segmentation;user exploration behavior;visual exploration;visual segmentation;volumetric data segment;volumetric dataset	Entropy;Histograms;Image segmentation;Shape analysis;Transfer functions;Visualization;Volume measurement	Information-guided exploration;Volume exploration;normalized cut;volume classification	Visual exploration of volumetric datasets to discover the embedded features and spatial structures is a challenging and tedious task. In this paper we present a semi-automatic approach to this problem that works by visually segmenting the intensity-gradient 2D histogram of a volumetric dataset into an exploration hierarchy. Our approach mimics user exploration behavior by analyzing the histogram with the normalized-cut multilevel segmentation technique. Unlike previous work in this area, our technique segments the histogram into a reasonable set of intuitive components that are mutually exclusive and collectively exhaustive. We use information-theoretic measures of the volumetric data segments to guide the exploration. This provides a data-driven coarse-to-fine hierarchy for a user to interactively navigate the volume in a meaningful manner.	Cheuk Yiu Ip;Varshney, A.;JaJa, J.	Inst. for Adv. Comput. Studies, Univ. of Maryland, College Park, MD, USA|c|;;	37586231900;37282560200;37276261200
	SciVis+InfoVis+some VAST	Dec. 2012	Historygrams: Enabling Interactive Global Illumination in Direct Volume Rendering using Photon Mapping	10.1109/TVCG.2012.232	http://dx.doi.org/10.1109/TVCG.2012.232	2364	2371	6327241	interactive systems;lighting;rendering (computer graphics)	DVR;TF;advanced global illumination techniques;arbitrary phase functions;bidirectional reflectance distribution functions;direct volume rendering;historygram approach;interactive transfer function;interactive volumetric global illumination;light sources;light transport equations;material editing;parameter change;photon mapping techniques;photon media interactions;photon scattering events;property change;view-ray	Lighting;Photonics;Rendering (computer graphics);Scattering;Volume measurement	Volume rendering;global illumination;participating media;photon mapping	In this paper, we enable interactive volumetric global illumination by extending photon mapping techniques to handle interactive transfer function (TF) and material editing in the context of volume rendering. We propose novel algorithms and data structures for finding and evaluating parts of a scene affected by these parameter changes, and thus support efficient updates of the photon map. In direct volume rendering (DVR) the ability to explore volume data using parameter changes, such as editable TFs, is of key importance. Advanced global illumination techniques are in most cases computationally too expensive, as they prevent the desired interactivity. Our technique decreases the amount of computation caused by parameter changes, by introducing Historygrams which allow us to efficiently reuse previously computed photon media interactions. Along the viewing rays, we utilize properties of the light transport equations to subdivide a view-ray into segments and independently update them when invalid. Unlike segments of a view-ray, photon scattering events within the volumetric medium needs to be sequentially updated. Using our Historygram approach, we can identify the first invalid photon interaction caused by a property change, and thus reuse all valid photon interactions. Combining these two novel concepts, supports interactive editing of parameters when using volumetric photon mapping in the context of DVR. As a consequence, we can handle arbitrarily shaped and positioned light sources, arbitrary phase functions, bidirectional reflectance distribution functions and multiple scattering which has previously not been possible in interactive DVR.	Jonsson, D.;Kronander, J.;Ropinski, T.;Ynnerman, A.	Linkoping Univ., Linkoping, Sweden|c|;;;	38228659100;38230927900;37295281400;37284192000
	SciVis+InfoVis+some VAST	Dec. 2012	Structure-Aware Lighting Design for Volume Visualization	10.1109/TVCG.2012.267	http://dx.doi.org/10.1109/TVCG.2012.267	2372	2381	6327242	data visualisation;rendering (computer graphics);transfer functions	detail perception;direct volume rendering;external lighting;feature information;human visual system;image information;lighting similarity;lighting stability;multiple light sources;shape perception;structural information enhancement;structure-aware automatic lighting design;transfer function;volume data sets;volume visualization	Entropy;Light sources;Lighting;Measurement;Rendering (computer graphics);Shape analysis;Stability analysis	Automatic lighting design;lighting similarity;lighting stability;structural dissimilarity;volume rendering	Lighting design is a complex, but fundamental, problem in many fields. In volume visualization, direct volume rendering generates an informative image without external lighting, as each voxel itself emits radiance. However, external lighting further improves the shape and detail perception of features, and it also determines the effectiveness of the communication of feature information. The human visual system is highly effective in extracting structural information from images, and to assist it further, this paper presents an approach to structure-aware automatic lighting design by measuring the structural changes between the images with and without external lighting. Given a transfer function and a viewpoint, the optimal lighting parameters are those that provide the greatest enhancement to structural information - the shape and detail information of features are conveyed most clearly by the optimal lighting parameters. Besides lighting goodness, the proposed metric can also be used to evaluate lighting similarity and stability between two sets of lighting parameters. Lighting similarity can be used to optimize the selection of multiple light sources so that different light sources can reveal distinct structural information. Our experiments with several volume data sets demonstrate the effectiveness of the structure-aware lighting design approach. It is well suited to use by novices as it requires little technical understanding of the rendering parameters associated with direct volume rendering.	Yubo Tao	State Key Lab. of CAD&amp;CG, Zhejiang Univ., Hangzhou, China|c|	
	SciVis+InfoVis+some VAST	Dec. 2012	Multivariate Data Analysis Using Persistence-Based Filtering and Topological Signatures	10.1109/TVCG.2012.248	http://dx.doi.org/10.1109/TVCG.2012.248	2382	2391	6327243	data analysis;data structures;data visualisation;history;information filtering;pattern classification;topology	algebraic topology;analysis pipeline;arbitrary high-dimensional data sets;central structures;cultural heritage;data points classification;hierarchical manner;high-dimensional real-world data sets;interaction capability;interactive visualization techniques;large data sets;multivariate data analysis;noisy data;parameter space evaluation;persistence rings;persistence-based filtering algorithm;persistent homology;problem complexity;relevant structures;significant structures extraction;stopping criterion;synthetic data sets;topological data analysis;topological features;topological objects;topological signatures;visualization pipeline	Clustering methods;Multivariate data sets;Network topology	Topological persistence;clustering;multivariate data	The extraction of significant structures in arbitrary high-dimensional data sets is a challenging task. Moreover, classifying data points as noise in order to reduce a data set bears special relevance for many application domains. Standard methods such as clustering serve to reduce problem complexity by providing the user with classes of similar entities. However, they usually do not highlight relations between different entities and require a stopping criterion, e.g. the number of clusters to be detected. In this paper, we present a visualization pipeline based on recent advancements in algebraic topology. More precisely, we employ methods from persistent homology that enable topological data analysis on high-dimensional data sets. Our pipeline inherently copes with noisy data and data sets of arbitrary dimensions. It extracts central structures of a data set in a hierarchical manner by using a persistence-based filtering algorithm that is theoretically well-founded. We furthermore introduce persistence rings, a novel visualization technique for a class of topological features-the persistence intervals-of large data sets. Persistence rings provide a unique topological signature of a data set, which helps in recognizing similarities. In addition, we provide interactive visualization techniques that assist the user in evaluating the parameter space of our method in order to extract relevant structures. We describe and evaluate our analysis pipeline by means of two very distinct classes of data sets: First, a class of synthetic data sets containing topological objects is employed to highlight the interaction capabilities of our method. Second, in order to affirm the utility of our technique, we analyse a class of high-dimensional real-world data sets arising from current research in cultural heritage.	Rieck, B.;Mara, H.;Leitte, H.	Interdiscipl. Center for Sci. Comput. (IWR), Heidelberg Univ., Heidelberg, Germany|c|;;	38489062800;37298496400;38488927600
