	VAST	Oct. 31 2006-Nov. 2 2006	Semantic Image Browser: Bridging Information Visualization with Automated Intelligent Image Analysis	10.1109/VAST.2006.261425	http://dx.doi.org/10.1109/VAST.2006.261425	191	198	4035765	data visualisation;image retrieval;interactive systems	automated intelligent image analysis;high dimensional visualization;image retrieval;information visualization;interaction tools;interactive visual exploration;large image databases;multidimensional scaling based image layout;semantic image analysis;semantic image browser;semantic image classification;value and relation display;visual analytics	Computer science;Computerized monitoring;Displays;Image analysis;Image classification;Image databases;Image retrieval;Information retrieval;Visual analytics;Visualization	1.4.8 [Image Processing and Computer Vision]: Scene Analysis¿Object recognition;H.3.3 [Information Storage and Retrieval]: Information Search and Retrieval¿Search process;H.5.2 [Information Interfaces and Presentation]: User Interfaces¿Graphical user interfaces;Image retrieval;image layout;multi-dimensional visualization;semantic image classification;visual analytics	Browsing and retrieving images from large image collections are becoming common and important activities. Semantic image analysis techniques, which automatically detect high level semantic contents of images for annotation, are promising solutions toward this problem. However, few efforts have been made to convey the annotation results to users in an intuitive manner to enable effective image browsing and retrieval. There is also a lack of methods to monitor and evaluate the automatic image analysis algorithms due to the high dimensional nature of image data, features, and contents. In this paper, we propose a novel, scalable semantic image browser by applying existing information visualization techniques to semantic image analysis. This browser not only allows users to effectively browse and search in large image databases according to the semantic content of images, but also allows analysts to evaluate their annotation process through interactive visual exploration. The major visualization components of this browser are multi-dimensional scaling (MDS) based image layout, the value and relation (VaR) display that allows effective high dimensional visualization without dimension reduction, and a rich set of interaction tools such as search by sample images and content relationship detection. Our preliminary user study showed that the browser was easy to use and understand, and effective in supporting image browsing and retrieval tasks	Jing Yang;Jianping Fan;Hubball, D.;Yuli Gao;Hangzai Luo;Ribarsky, W.;Ward, M.	Dept. of Comput. Sci., Univ. of North Carolina at Charlotte, NC|c|;;;;;;	37292632600;37271216800;37300421500;37404899900;37275772500;37300425000;37268441700
	VAST	Oct. 31 2006-Nov. 2 2006	Pixnostics: Towards Measuring the Value of Visualization	10.1109/VAST.2006.261423	http://dx.doi.org/10.1109/VAST.2006.261423	199	206	4035766	data analysis;data visualisation;image processing	pixel image analysis;visual analytics;visual data analysis;visual data exploration;visualization value measurement	Color;Data analysis;Data visualization;Humans;Image analysis;Pattern analysis;Pixel;Space technology;USA Councils;Visual analytics	1.6.9 [Visualization]: Information Visualization¿Visualization Techniques and Methodologies;Visual Analytics;Visual Data Exploration;Visualization technique	During the last two decades a wide variety of advanced methods for the visual exploration of large data sets have been proposed. For most of these techniques user interaction has become a crucial element, since there are many situations in which a user or an analyst has to select the right parameter settings from among many or select a subset of the available attribute space for the visualization process, in order to construct valuable visualizations that provide insight, into the data and reveal interesting patterns. The right choice of input parameters is often essential, since suboptimal parameter settings or the investigation of irrelevant data dimensions make the exploration process more time consuming and may result in wrong conclusions. In this paper we propose a novel method for automatically determining meaningful parameter- and attribute settings based on the information content of the resulting visualizations. Our technique called Pixnostics, in analogy to Scagnostics (Wilkinson et al., 2005), automatically analyses pixel images resulting from diverse parameter mappings and ranks them according to the potential value for the user. This allows a more effective and more efficient visual data analysis process, since the attribute/parameter space is reduced to meaningful selections and thus the analyst obtains faster insight into the data. Real world applications are provided to show the benefit of the proposed approach	Schneidewind, J.;Sips, M.;Keim, D.A.	Konstanz Univ.|c|;;	37669961800;37827860500;37283138700
	VAST	Oct. 31 2006-Nov. 2 2006	VAST 2006 Contest - A Tale of Alderwood	10.1109/VAST.2006.261420	http://dx.doi.org/10.1109/VAST.2006.261420	215	216	4035768	data analysis;data visualisation	Alderwood;human information interaction;sense making;visual analytics science and technology contest	Cities and towns;Data analysis;Data visualization;Feedback;Graphical user interfaces;Humans;IEEE news;Laboratories;NIST;Visual analytics	H.5.2 [Information Interfaces & Presentations]: User Interfaces - Graphical User Interfaces (GUI);contest;evaluation;human information interaction;metrics;sense making;visual analytics	Visual analytics experts realize that one effective way to push the field forward and to develop metrics for measuring the performance of various visual analytics components is to hold an annual competition. The first visual analytics science and technology (VAST) contest was held in conjunction with the 2006 IEEE VAST Symposium. The competition entailed the identification of possible political shenanigans in the fictitious town of Alderwood. A synthetic data set was made available as well as tasks. We summarize how we prepared and advertised the contest, developed some initial metrics for evaluation, and selected the winners. The winners were invited to participate at an additional live competition at the symposium to provide them with feedback from senior analysts	Grinstein, G.;O'Connell, T.;Laskowski, S.;Plaisant, C.;Scholtz, J.;Whiting, M.	Univ. of Massachusetts Lowell, MA|c|;;;;;	37360588500;37825268500;37837224000;37283026800;37268671300;37357067600
	InfoVis+SciVis	Sept.-Oct. 2006	Vis/InfoVis 2006 pre-pages	10.1109/TVCG.2006.191	http://dx.doi.org/10.1109/TVCG.2006.191	vispre	vispre	4015415					These pre-pages to the issue contain a table of contents, a list of supporting organizations, a message from the Editor-in-Chief, the preface, committee and reviewer listings, 2005 visualization awards, and the keynote and capstone addressess for Vis and InfoVis.			
	InfoVis+SciVis	Sept.-Oct. 2006	ASK-GraphView: A Large Scale Graph Visualization System	10.1109/TVCG.2006.120	http://dx.doi.org/10.1109/TVCG.2006.120	669	676	4015416	data visualisation;graph theory;pattern clustering	ASK-GraphView;cluster labeling;graph clustering;interactive navigation;large scale graph visualization system;node-link-based graph visualization system;weighted undirected input graph	Aggregates;Clustering algorithms;Filtering;Finite element methods;Labeling;Large-scale systems;Navigation;Scalability;Tree graphs;Visualization	Graph Clustering.;Graph Visualization;Information Visualization	We describe ASK-GraphView, a node-link-based graph visualization system that allows clustering and interactive navigation of large graphs, ranging in size up to 16 million edges. The system uses a scalable architecture and a series of increasingly sophisticated clustering algorithms to construct a hierarchy on an arbitrary, weighted undirected input graph. By lowering the interactivity requirements we can scale to substantially bigger graphs. The user is allowed to navigate this hierarchy in a top down manner by interactively expanding individual clusters. ASK-GraphView also provides facilities for filtering and coloring, annotation and cluster labeling	Abello, J.;Neeraj Krishnan	Rutgers Univ., New Brunswick, NJ|c|;	38357070200;37823691100
	InfoVis+SciVis	Sept.-Oct. 2006	MatrixExplorer: a Dual-Representation System to Explore Social Networks	10.1109/TVCG.2006.160	http://dx.doi.org/10.1109/TVCG.2006.160	677	684	4015417	data visualisation;diagrams;graph theory;matrix algebra;pattern clustering;social sciences computing	MatrixExplorer;clustering functions;dual-representation system;interactive filtering;matrix-based representations;network visualization system;node-link diagrams;social networks		consensus.;exploratory process;interactive clustering;matrix ordering;matrix-based representations;node-link diagrams;social networks visualization	MatrixExplorer is a network visualization system that uses two representations: node-link diagrams and matrices. Its design comes from a list of requirements formalized after several interviews and a participatory design session conducted with social science researchers. Although matrices are commonly used in social networks analysis, very few systems support the matrix-based representations to visualize and analyze networks. MatrixExplorer provides several novel features to support the exploration of social networks with a matrix-based representation, in addition to the standard interactive filtering and clustering functions. It provides tools to reorder (layout) matrices, to annotate and compare findings across different layouts and find consensus among several clusterings. MatrixExplorer also supports node-link diagram views which are familiar to most users and remain a convenient way to publish or communicate exploration results. Matrix and node-link representations are kept synchronized at all stages of the exploration process	Henry, N.;Fekete, J.	LRI|c|;	37839948300;37407972900
	InfoVis+SciVis	Sept.-Oct. 2006	Visual Analysis of Multivariate State Transition Graphs	10.1109/TVCG.2006.192	http://dx.doi.org/10.1109/TVCG.2006.192	685	692	4015418	data visualisation;diagrams;pattern clustering;tree data structures;trees (mathematics)	arc diagram;bar tree;hierarchically structured quantitative data visualization;industrial wafer stepper;interactive attribute-based clustering facility;multivariate state transition graphs;node-link diagram;relational data;visual analysis	Automata;Computer languages;Computer science;Data visualization;Industrial relations;Mathematics;Semiconductor device modeling;State-space methods;Tree graphs	Graph visualization;finite state machines.;interactive clustering;multivariate visualization;state spaces;transition systems	We present a new approach for the visual analysis of state transition graphs. We deal with multivariate graphs where a number of attributes are associated with every node. Our method provides an interactive attribute-based clustering facility. Clustering results in metric, hierarchical and relational data, represented in a single visualization. To visualize hierarchically structured quantitative data, we introduce a novel technique: the bar tree. We combine this with a node-link diagram to visualize the hierarchy and an arc diagram to visualize relational data. Our method enables the user to gain significant insight into large state transition graphs containing tens of thousands of nodes. We illustrate the effectiveness of our approach by applying it to a real-world use case. The graph we consider models the behavior of an industrial wafer stepper and contains 55 043 nodes and 289 443 edges	Pretorius, A.J.;van Wijk, J.J.	Dept. of Math. & Comput. Sci., Technische Univ. Eindhoven|c|;	37283038200;37267249200
	InfoVis+SciVis	Sept.-Oct. 2006	Balancing Systematic and Flexible Exploration of Social Networks	10.1109/TVCG.2006.122	http://dx.doi.org/10.1109/TVCG.2006.122	693	700	4015419	data analysis;data visualisation;graph theory;graphical user interfaces;matrix algebra;social sciences computing	SocialAction;attribute ranking;data analysis;matrix overview;network visualization;social network analysis;statistical methods	Aggregates;Coordinate measuring machines;Data analysis;Data visualization;Filters;Gain measurement;Navigation;Pattern analysis;Social network services;Statistical analysis	Social networks;attribute ranking;coordinated views;exploratory data analysis;interactive graph visualization	Social network analysis (SNA) has emerged as a powerful method for understanding the importance of relationships in networks. However, interactive exploration of networks is currently challenging because: (1) it is difficult to find patterns and comprehend the structure of networks with many nodes and links, and (2) current systems are often a medley of statistical methods and overwhelming visual output which leaves many analysts uncertain about how to explore in an orderly manner. This results in exploration that is largely opportunistic. Our contributions are techniques to help structural analysts understand social networks more effectively. We present SocialAction, a system that uses attribute ranking and coordinated views to help users systematically examine numerous SNA measures. Users can (1) flexibly iterate through visualizations of measures to gain an overview, filter nodes, and find outliers, (2) aggregate networks using link structure, find cohesive subgroups, and focus on communities of interest, and (3) untangle networks by viewing different link types separately, or find patterns across different link types using a matrix overview. For each operation, a stable node layout is maintained in the network visualization so users can make comparisons. SocialAction offers analysts a strategy beyond opportunism, as it provides systematic, yet flexible, techniques for exploring social networks	Perer, A.;Shneiderman, B.	Dept. of Comput. Sci., Maryland Univ., College Park, MD|c|;	37294938400;37283016400
	InfoVis+SciVis	Sept.-Oct. 2006	Multi-Scale Banking to 45 Degrees	10.1109/TVCG.2006.163	http://dx.doi.org/10.1109/TVCG.2006.163	701	708	4015420	computational geometry;data visualisation;human factors;optimisation;spectral analysis;visual perception	aspect ratio;line chart;line segments;multiscale banking;optimization technique;spectral analysis;visual perception;visualization tools	Acceleration;Banking;Carbon dioxide;Data visualization;Design optimization;Frequency;Observatories;Spectral analysis;Time measurement;Visual perception	Information visualization;banking to 45 degrees;graphical perception;line charts;sparklines;time-series	In his text Visualizing Data, William Cleveland demonstrates how the aspect ratio of a line chart can affect an analyst's perception of trends in the data. Cleveland proposes an optimization technique for computing the aspect ratio such that the average absolute orientation of line segments in the chart is equal to 45 degrees. This technique, called banking to 45deg, is designed to maximize the discriminability of the orientations of the line segments in the chart. In this paper, we revisit this classic result and describe two new extensions. First, we propose alternate optimization criteria designed to further improve the visual perception of line segment orientations. Second, we develop multi-scale banking, a technique that combines spectral analysis with banking to 45deg. Our technique automatically identifies trends at various frequency scales and then generates a banked chart for each of these scales. We demonstrate the utility of our techniques in a range of visualization tools and analysis examples	Heer, J.;Agrawala, M.	Comput. Sci. Div., California Univ., Berkeley, CA|c|;	37550791300;37282718200
	InfoVis+SciVis	Sept.-Oct. 2006	Measuring Data Abstraction Quality in Multiresolution Visualizations	10.1109/TVCG.2006.161	http://dx.doi.org/10.1109/TVCG.2006.161	709	716	4015421	data analysis;data structures;data visualisation;pattern clustering;sampling methods;very large databases	XmdvTool;data abstraction quality measures;data clustering;histogram difference measure;multivariate data analysis;nearest neighbor measure;public-domain multiresolution visualization system	Bioinformatics;Coordinate measuring machines;Data analysis;Data visualization;Delay;Density measurement;Displays;Histograms;Nearest neighbor searches;Sampling methods	Clustering;Metrics;Multiresolution Visualization Authors 1:;Sampling	Data abstraction techniques are widely used in multiresolution visualization systems to reduce visual clutter and facilitate analysis from overview to detail. However, analysts are usually unaware of how well the abstracted data represent the original dataset, which can impact the reliability of results gleaned from the abstractions. In this paper, we define two data abstraction quality measures for computing the degree to which the abstraction conveys the original dataset: the histogram difference measure and the nearest neighbor measure. They have been integrated within XmdvTool, a public-domain multiresolution visualization system for multivariate data analysis that supports sampling as well as clustering to simplify data. Several interactive operations are provided, including adjusting the data abstraction level, changing selected regions, and setting the acceptable data abstraction quality level. Conducting these operations, analysts can select an optimal data abstraction level. Also, analysts can compare different abstraction methods using the measures to see how well relative data density and outliers are maintained, and then select an abstraction method that meets the requirement of their analytic tasks	Cui, Q.;Ward, M.O.;Rundensteiner, E.A.;Jing Yang	Worcester Polytech. Inst., MA|c|;;;	37841616400;37268441700;37279217900;37292632600
	InfoVis+SciVis	Sept.-Oct. 2006	Enabling Automatic Clutter Reduction in Parallel Coordinate Plots	10.1109/TVCG.2006.138	http://dx.doi.org/10.1109/TVCG.2006.138	717	724	4015422	data visualisation;hidden feature removal;probability;sampling methods	automatic clutter reduction;binning technique;occlusion;parallel coordinate plots;probabilistic approach;random sampling	Coordinate measuring machines;Data visualization;Displays;Filtering;Lenses;Motion measurement;Sampling methods	Sampling;clutter;density reduction;information visualisation;lens;occlusion;overplotting;parallel coordinates.;random sampling	We have previously shown that random sampling is an effective clutter reduction technique and that a sampling lens can facilitate focus+context viewing of particular regions. This demands an efficient method of estimating the overlap or occlusion of large numbers of intersecting lines in order to automatically adjust the sampling rate within the lens. This paper proposes several ways for measuring occlusion in parallel coordinate plots. An empirical study into the accuracy and efficiency of the occlusion measures show that a probabilistic approach combined with a 'binning' technique is very fast and yet approaches the accuracy of the more expensive 'true' complete measurement	Ellis, G.;Dix, A.	Lancaster Univ.|c|;	37283380700;37283381700
	InfoVis+SciVis	Sept.-Oct. 2006	Topographic Visualization of Prefix Propagation in the Internet	10.1109/TVCG.2006.185	http://dx.doi.org/10.1109/TVCG.2006.185	725	732	4015423	Internet;data visualisation;graph theory;telecommunication network routing	BGPlay service;ISP;Internet Service Providers;Internet routing monitoring tool;graph drawing;prefix propagation;topographic map;topographic visualization	Displays;IP networks;Local area networks;Monitoring;Real time systems;Routing;Springs;Testing;Visualization;Web and internet services	Graph Drawing;Interdomain Routing;Internet Visualization;Spring Embedder	We propose a new metaphor for the visualization of prefixes propagation in the Internet. Such a metaphor is based on the concept of topographic map and allows to put in evidence the relative importance of the Internet Service Providers (ISPs) involved in the routing of the prefix. Based on the new metaphor we propose an algorithm for computing layouts and experiment with such algorithm on a test suite taken from the real Internet. The paper extends the visualization approach of the BGPlay service, which is an Internet routing monitoring tool widely used by ISP operators	Cortese, P.F.;Moneta, A.;Patrignani, M.;Pizzonia, M.	Dipt. di Informatica e Automazione, Rome Univ.|c|;;;	37827873200;37827870000;37267060000;37294504700
	InfoVis+SciVis	Sept.-Oct. 2006	Network Visualization by Semantic Substrates	10.1109/TVCG.2006.166	http://dx.doi.org/10.1109/TVCG.2006.166	733	740	4015424	data visualisation;graphical user interfaces	NVSS 1.0;graphical user interfaces;information visualization designers;legal citations;legal precedent data;network visualization;user-defined semantic substrates	Automatic control;Data visualization;Displays;Filters;Graphical user interfaces;Law;Legal factors;Scalability;Terminology;Tunneling	Network visualization;graphical user interfaces;information visualization;semantic substrate	Networks have remained a challenge for information visualization designers because of the complex issues of node and link layout coupled with the rich set of tasks that users present. This paper offers a strategy based on two principles: (1) layouts are based on user-defined semantic substrates, which are non-overlapping regions in which node placement is based on node attributes, (2) users interactively adjust sliders to control link visibility to limit clutter and thus ensure comprehensibility of source and destination. Scalability is further facilitated by user control of which nodes are visible. We illustrate our semantic substrates approach as implemented in NVSS 1.0 with legal precedent data for up to 1122 court cases in three regions with 7645 legal citations	Shneiderman, B.;Aris, A.	Dept. of Comput. Sci., Maryland Univ., College Park, MD|c|;	37283016400;37561646300
	InfoVis+SciVis	Sept.-Oct. 2006	Hierarchical Edge Bundles: Visualization of Adjacency Relations in Hierarchical Data	10.1109/TVCG.2006.147	http://dx.doi.org/10.1109/TVCG.2006.147	741	748	4015425	curve fitting;data visualisation;splines (mathematics);tree data structures;trees (mathematics)	B-spline curve;adjacency relation visualization;compound graph;hierarchical data;hierarchical edge bundles;tree visualization method;visual clutter	Cables;Data visualization;Displays;Social network services;Software systems;Spline;Tree data structures;Tree graphs;Wires	Network visualization;curves;edge aggregation;edge bundling;edge concentration;graph visualization;hierarchies;node-link diagrams;tree visualization;treemaps.	A compound graph is a frequently encountered type of data set. Relations are given between items, and a hierarchy is defined on the items as well. We present a new method for visualizing such compound graphs. Our approach is based on visually bundling the adjacency edges, i.e., non-hierarchical edges, together. We realize this as follows. We assume that the hierarchy is shown via a standard tree visualization method. Next, we bend each adjacency edge, modeled as a B-spline curve, toward the polyline defined by the path via the inclusion edges from one node to another. This hierarchical bundling reduces visual clutter and also visualizes implicit adjacency edges between parent nodes that are the result of explicit adjacency edges between their respective child nodes. Furthermore, hierarchical edge bundling is a generic method which can be used in conjunction with existing tree visualization techniques. We illustrate our technique by providing example visualizations and discuss the results based on an informal evaluation provided by potential users of such visualizations	Holten, D.	Technische Univ. Eindhoven|c|	37827881300
