Paper ID,Paper Title,Abstract,Keywords,starting page,page range,Author 1: First Name,Author 1: Surname,Author 1: Affiliation,Author 2: First Name,Author 2: Surname,Author 2: Affiliation,Author 3: First Name,Author 3: Surname,Author 3: Affiliation,Author 4: First Name,Author 4: Surname,Author 4: Affiliation,Author 5: First Name,Author 5: Surname,Author 5: Affiliation,Author 6: First Name,Author 6: Surname,Author 6: Affiliation,Author 7: First Name,Author 7: Surname,Author 7: Affiliation,Author 8: First Name,Author 8: Surname,Author 8: Affiliation,Author 9: First Name,Author 9: Surname,Author 9: Affiliation225,An Efficient Direct Volume Rendering Approach for Dichromats,"Color vision deficiency (CVD) affects a high percentage of the population worldwide. When seeing a volume visualization result, persons with CVD may be incapable of discriminating the classification information expressed in the image if the color transfer function or the color blending used in the direct volume rendering is not appropriate. Conventional methods used to address this problem adopt advanced image recoloring techniques to enhance the rendering results frame-by-frame; unfortunately, problematic perceptual results may still be generated. This paper proposes an alternative solution that complements the image recoloring scheme by reconfiguring the components of the direct volume rendering (DVR) pipeline. Our approach optimizes the mapped colors of a transfer function to simulate CVD-friendly effect that is generated by applying the image recoloring to the results with the initial transfer function. The optimization process has a low computational complexity, and only needs to be performed once for a given transfer function. To achieve detail-preserving and perceptually natural semi-transparent effects, we introduce a new color composition mode that works in the color space of dichromats. Experimental results and a pilot study demonstrates that our approach can yield dichromats-friendly and consistent volume visualization in real-time.","Dichromacy, direct volume rendering, volume classification, image recoloring.",2144,2144-2152,Weifeng,Chen,Zhejiang University,Wei,Chen,Zhejiang University,Hujun,Bao,Zhejiang University,,,,,,,,,,,,,,,,,,144,Interactive Virtual Probing of 4D MRI Blood-Flow,"Better understanding of hemodynamics conceivably leads to improved diagnosis and prognosis of cardiovascular diseases. Therefore, an elaborate analysis of the blood-flow in heart and thoracic arteries is essential. Contemporary MRI techniques enable acquisition of quantitative time-resolved flow information, resulting in 4D velocity fields that capture the blood-flow behavior. Visual exploration of these fields provides comprehensive insight into the unsteady blood-flow behavior, and precedes a quantitative analysis of additional blood-flow parameters. The complete inspection requires accurate segmentation of anatomical structures, encompassing a time-consuming and hard-to-automate process, especially for malformed morphologies. We present a way to avoid the laborious segmentation process in case of qualitative inspection, by introducing an interactive virtual probe. This probe is positioned semi-automatically within the blood-flow field, and serves as a navigational object for visual exploration. The difficult task of determining position and orientation along the view-direction is automated by a fitting approach, aligning the probe with the orientations of the velocity field. The aligned probe provides an interactive seeding basis for various flow visualization approaches. We demonstrate illustration-inspired particles, integral lines and integral surfaces, conveying distinct characteristics of the unsteady blood-flow. Lastly, we present the results of an evaluation with domain experts, valuing the practical use of our probe and flow visualization techniques.","Probing, Flow visualization, Illustrative visualization, Multivalued images, Phase-contrast cine MRI.",2153,2153-2162,Roy,van Pelt,"Eindhoven University of Technology, \ The Netherlands",Javier,Olivan Bescos,"Philips Healthcare, \ The Netherlands",Marcel,Breeuwer,"Philips Healthcare, \ The Netherlands",Rachel E.,Clough,"NIHR Comprehensive Biomedical \ Research Centre of Guy‚Äôs and St Thomas‚Äô NHS Foundation Trust and \ King‚Äôs College London, United Kingdom",M. Eduard,Groeller,"Vienna University of Technology, \ Austria",Bart,ter Haar Romenij,"Eindhoven University of Technology, \ The Netherlands",Anna,Vilanova,"Eindhoven University of Technology, \ The Netherlands",,,,,,118,Crepuscular Rays for Tumor Accessibility Planning,"In modern clinical practice, planning access paths to volumetric target structures remains one of the most important and most complex tasks, and a physician's insufficient experience in this can lead to severe complications or even the death of the patient. In this paper, we present a method for safety evaluation and the visualization of access paths to assist physicians during preoperative planning. As a metaphor for our method, we employ a well-known, and thus intuitively perceivable, natural phenomenon that is usually called crepuscular rays. Using this metaphor, we propose several ways to compute the safety of paths from the region of interest to all tumor voxels and show how this information can be visualized in real-time using a multi-volume rendering system. Furthermore, we show how to estimate the extent of connected safe areas to improve common medical 2D multi-planar reconstruction (MPR) views. We evaluate our method by means of expert interviews, an online survey, and a retrospective evaluation of 19 real abdominal radio-frequency ablation (RFA) interventions, with expert decisions serving as a gold standard. The evaluation results show clear evidence that our method can be successfully applied in clinical practice without introducing substantial overhead work for the acting personnel. Finally, we show that our method is not limited to medical applications and that it can also be useful in other fields.","Accessibility, ray casting, medical visualization.",2163,2163-2172,Rostislav,Khlebnikov,Graz University of Technology,Bernhard,Kainz,Graz University of Technology,Judith,Muehl,Graz University of Technology,Dieter,Schmalstieg,Graz University of Technology,,,,,,,,,,,,,,,105,Distance Visualization for Interactive 3D Implant Planning,"An instant and quantitative assessment of spatial distances between two objects plays an important role in interactive applications such as virtual model assembly, medical operation planning, or computational steering. While some research has been done on the development of distance-based measures between two objects, only very few attempts have been reported to visualize such measures in interactive scenarios. In this paper we present two different approaches for this purpose, and we investigate the effectiveness of these approaches for intuitive 3D implant positioning in a medical operation planning system. The first approach uses cylindrical glyphs to depict distances, which smoothly adapt their shape and color to changing distances when the objects are moved. This approach computes distances directly on the polygonal object representations by means of ray/triangle mesh intersection. The second approach introduces a set of slices as additional geometric structures, and uses color coding on surfaces to indicate distances. This approach obtains distances from a precomputed distance field of each object. The major findings of the performed user study indicate that a visualization that can facilitate an instant and quantitative analysis of distances between two objects in interactive 3D scenarios is demanding, yet can be achieved by including additional monocular cues into the visualization.","Distance visualization, biomedical visualization, implant planning, glyphs, distance fields.",2173,2173-2182,Christian,Dick,Technische Universität München,Rainer,Burgkart,Technische Universität München,Rüdiger,Westermann,Technische Universität München,,,,,,,,,,,,,,,,,,209,The FLOWLENS: A Focus-and-Context Visualization Approach for Exploration of Blood Flow in Cerebral Aneurysms,"Blood flow and derived data are essential to investigate the initiation and progression of cerebral aneurysms as well as their risk of rupture. An effective visual exploration of several hemodynamic attributes like the wall shear stress (WSS) and the inflow jet is necessary to understand the hemodynamics. Moreover, the correlation between focus-and-context attributes is of particular interest. An expressive visualization of these attributes and anatomic information requires appropriate visualization techniques to minimize visual clutter and occlusions. We present the FLOWLENS as a focus-and-context approach that addresses these requirements. We group relevant hemodynamic attributes to pairs of focus-and-context attributes and assign them to different anatomic scopes. For each scope, we propose several FLOWLENS visualization templates to provide a flexible visual filtering of the involved hemodynamic pairs. A template consists of the visualization of the focus attribute and the additional depiction of the context attribute inside the lens. Furthermore, the FLOWLENS supports local probing and the exploration of attribute changes over time. The FLOWLENS minimizes visual cluttering, occlusions, and provides a flexible exploration of a region of interest. We have applied our approach to seven representative datasets, including steady and unsteady flow data from CFD simulations and 4D PC-MRI measurements. Informal user interviews with three domain experts confirm the usefulness of our approach.","Flow Visualization, Focus-and-Context, Illustrative Rendering, Aneurysm.",2183,2183-2192,Rocco,Gasteiger,"Department of Simulation and Graphics, University of Magdeburg, Germany",Mathias,Neugebauer,"Department of Simulation and Graphics, University of Magdeburg, Germany",Oliver,Beuing,"Department of Neuroradiology, University Hospital Magdeburg, Germany",Bernhard,Preim,"Department of Simulation and Graphics, University of Magdeburg, Germany",,,,,,,,,,,,,,,226,Projection-Based Metal-Artifact Reduction for Industrial 3D X-ray Computed Tomography,"Multi-material components, which contain metal parts surrounded by plastic materials, are highly interesting for inspection using industrial 3D X-ray computed tomography (3DXCT). Examples of this application scenario are connectors or housings with metal inlays in the electronic or automotive industry. A major problem of this type of components is the presence of metal, which causes streaking artifacts and distorts the surrounding media in the reconstructed volume. Streaking artifacts and dark-band artifacts around metal components significantly influence the material characterization (especially for the plastic components). In specific cases these artifacts even prevent a further analysis. Due to the nature and the different characteristics of artifacts, the development of an efficient artifact-reduction technique in reconstruction-space is rather complicated. In this paper we present a projection-space pipeline for metal-artifacts reduction. The proposed technique first segments the metal in the spatial domain of the reconstructed volume in order to separate it from the other materials. Then metal parts are forward-projected on the set of projections in a way that metal-projection regions are treated as voids. Subsequently the voids, which are left by the removed metal, are interpolated in the 2D projections. Finally, the metal is inserted back into the reconstructed 3D volume during the fusion stage. We present a visual analysis tool, allowing for interactive parameter estimation of the metal segmentation. The results of the proposed artifact-reduction technique are demonstrated on a test part as well as on real world components. For these specimens we achieve a significant reduction of metal artifacts, allowing an enhanced material characterization.","Metal-artifact reduction, multi-material components, visual analysis, 3D X-ray computed tomography.",2193,2193-2202,Artem,Amirkhanov,"Institute of Computer Graphics and Algorithms, Vienna University of Technology",Christoph,Heinzl,"Upper Austrian University of Applied Sciences, Wels Campus",Michael,Reiter,"Upper Austrian University of Applied Sciences, Wels Campus",Johann,Kastner,"Upper Austrian University of Applied Sciences, Wels Campus",Eduard,Gröller,"Institute of Computer Graphics and Algorithms, Vienna University of Technology",,,,,,,,,,,,318,Quality Metrics in High-Dimensional Data Visualization: An Overview and Systematization,"In this paper, we present a systematization of techniques that use quality metrics to help in the visual exploration of meaningful patterns in high-dimensional data. In a number of recent papers, different quality metrics are proposed to automate the demanding search through large spaces of alternative visualizations (e.g., alternative projections or ordering), allowing the user to concentrate on the most promising visualizations suggested by the quality metrics. Over the last decade, this approach has witnessed a remarkable development but few reflections exist on how these methods are related to each other and how the approach can be developed further. For this purpose, we provide an overview of approaches that use quality metrics in high-dimensional data visualization and propose a systematization based on a thorough literature review. We carefully analyze the papers and derive a set of factors for discriminating the quality metrics, visualization techniques, and the process itself. The process is described through a reworked version of the well-known information visualization pipeline. We demonstrate the usefulness of our model by applying it to several existing approaches that use quality metrics, and we provide reflections on implications of our model for future research.","Quality Metrics, High-Dimensional Data Visualization.",2203,2203-2212,Enrico,Bertini,University of Konstanz,Andrada,Tatu,University of Konstanz,Daniel,Keim,University of Konstanz,,,,,,,,,,,,,,,,,,215,Benefitting InfoVis with Visual Difficulties,"Many well-cited theories for visualization design state that a visual representation should be optimized for quick and immediate interpretation by a user. Distracting elements like decorative""chartjunk"" or extraneous information are avoided so as not to slow comprehension. Yet several recent studies in visualization research provide evidence that non-efficient visual elements may benefit comprehension and recall on the part of users. Similarly, findings from studies related to learning from visual displays in various subfields of psychology suggest that introducing cognitive difficulties to visualization interaction can improve a user's understanding of important information. In this paper, we synthesize empirical results from cross-disciplinary research on visual information representations, providing a counterpoint to efficiency-based design theory with guidelines that describe how visual difficulties can be introduced to benefit comprehension and recall. We identify conditions under which the application of visual difficulties is appropriate based on underlying factors in visualization interaction like active processing and engagement. We characterize effective graph design as a trade-off between efficiency and learning difficulties in order to provide Information Visualization (InfoVis) researchers and practitioners with a framework for organizing explorations of graphs for which comprehension and recall are crucial. We identify implications of this view for the design and evaluation of information visualizations.","desirable difficulites, cognitive efficiency, active processing, engagement, individual differences.",2213,2213-2222,Jessica,Hullman,University of Michigan School of Information,Eytan,Adar,University of Michigan School of Information,Priti,Shah,University of Michigan,,,,,,,,,,,,,,,,,,110,Product plots,"We propose a new framework for visualising tables of counts, proportions and probabilities. We call our framework product plots, alluding to the computation of area as a product of height and width, and the statistical concept of generating a joint distribution from the product of conditional and marginal distributions. The framework, with extensions, is sufficient to encompass over 20 visualisations previously described in fields of statistical graphics and infovis, including bar charts, mosaic plots, treemaps, equal area plots and fluctuation diagrams.","Statistics, joint distribution, conditional distribution, treemap, bar chart, mosaic plot.",2223,2223-2230,Hadley,Wickham,Rice University,Heike,Hofmann,Iowa State University,,,,,,,,,,,,,,,,,,,,,210,Visualization Rhetoric: Framing Effects in Narrative Visualization,"Narrative visualizations combine conventions of communicative and exploratory information visualization to convey an intended story. We demonstrate visualization rhetoric as an analytical framework for understanding how design techniques that prioritize particular interpretations in visualizations that""tell a story"" can significantly affect end-user interpretation. We draw a parallel between narrative visualization interpretation and evidence from framing studies in political messaging, decision-making, and literary studies. Devices for understanding the rhetorical nature of narrative information visualizations are presented, informed by the rigorous application of concepts from critical theory, semiotics, journalism, and political theory. We draw attention to how design tactics represent additions or omissions of information at various levels—the data, visual representation, textual annotations, and interactivity—and how visualizations denote and connote phenomena with reference to unstated viewing conventions and codes. Classes of rhetorical techniques identified via a systematic analysis of recent narrative visualizations are presented, and characterized according to their rhetorical contribution to the visualization. We describe how designers and researchers can benefit from the potentially positive aspects of visualization rhetoric in designing engaging, layered narrative visualizations and how our framework can shed light on how a visualization design prioritizes specific interpretations. We identify areas where future inquiry into visualization rhetoric can improve understanding of visualization interpretation.","Rhetoric, narrative visualization, framing effects, semiotics, denotation, connotation.",2231,2231-2240,Jessica,Hullman,University of Michigan School of Information,Nick,Diakopoulos,Rutgers University School of Information and Communication,,,,,,,,,,,,,,,,,,,,,308,Adaptive Privacy-Preserving Visualization Using Parallel Coordinates,"Current information visualization techniques assume unrestricted access to data. However, privacy protection is a key issue for a lot of real-world data analyses. Corporate data, medical records, etc. are rich in analytical value but cannot be shared without first going through a transformation step where explicit identifiers are removed and the data is sanitized. Researchers in the field of data mining have proposed different techniques over the years for privacy-preserving data publishing and subsequent mining techniques on such sanitized data. A well-known drawback in these methods is that for even a small guarantee of privacy, the utility of the datasets is greatly reduced. In this paper, we propose an adaptive technique for privacy preser vation in parallel coordinates. Based on knowledge about the sensitivity of the data, we compute a clustered representation on the fly, which allows the user to explore the data without breaching privacy. Through the use of screen-space privacy metrics, the technique adapts to the user's screen parameters and interaction. We demonstrate our method in a case study and discuss potential attack scenarios.","parallel coordinates, privacy, clustering.",2241,2241-2248,Aritra,Dasgupta,UNC-Charlotte,Robert,Kosara,UNC-Charlotte,,,,,,,,,,,,,,,,,,,,,132,Context-Preserving Visual Links,"Evaluating, comparing, and interpreting related pieces of information are tasks that are commonly performed during visual data analysis and in many kinds of information-intensive work. Synchronized visual highlighting of related elements is a well-known technique used to assist this task. An alternative approach, which is more invasive but also more expressive is visual linking in which line connections are rendered between related elements. In this work, we present context-preserving visual links as a new method for generating visual links. The method specifically aims to fulfill the following two goals: first, visual links should minimize the occlusion of important information; second, links should visually stand out from surrounding information by minimizing visual interference. We employ an image-based analysis of visual saliency to determine the important regions in the original representation. A consequence of the image-based approach is that our technique is application-independent and can be employed in a large number of visual data analysis scenarios in which the underlying content cannot or should not be altered. We conducted a controlled experiment that indicates that users can find linked elements in complex visualizations more quickly and with greater subjective satisfaction than in complex visualizations in which plain highlighting is used. Context-preserving visual links were perceived as visually more attractive than traditional visual links that do not account for the context information.","Visual links, highlighting, connectedness, routing, image-based, saliency.",2249,2249-2258,Markus,Steinberger,Graz University of Technology,Manuela,Waldner,Graz University of Technology,Marc,Streit,Graz University of Technology,Alexander,Lex,Graz University of Technology,Dieter,Schmalstieg,Graz University of Technology ,,,,,,,,,,,,233,"Design Study of LineSets, a Novel Set Visualization Technique","Computing and visualizing sets of elements and their relationships is one of the most common tasks one performs when analyzing and organizing large amounts of data. Common representations of sets such as convex or concave geometries can become cluttered and difficult to parse when these sets overlap in multiple or complex ways, e.g., when multiple elements belong to multiple sets. In this paper, we present a design study of a novel set visual representation, LineSets, consisting of a curve connecting all of the set's elements. Our approach to design the visualization differs from traditional methodology used by the InfoVis community. We first explored the potential of the visualization concept by running a controlled experiment comparing our design sketches to results from the state-of-the-art technique. Our results demonstrated that LineSets are advantageous for certain tasks when compared to concave shapes. We discuss an implementation of LineSets based on simple heuristics and present a study demonstrating that our generated curves do as well as human-drawn ones. Finally, we present two applications of our technique in the context of search tasks on a map and community analysis tasks in social networks.","Set visualization, clustering, faceted data visualization, graph visualization.",2259,2259-2267,Basak,Alper,"Microsoft Research, UC Santa Barbara",Nathalie,Riche,Microsoft Research,Gonzalo,Ramos,Microsoft Research,Mary,Czerwinski,Microsoft Research,,,,,,,,,,,,,,,356,Developing and Evaluating Quilts for the Depiction of Large Layered Graphs,"Traditional layered graph depictions such as flow charts are in wide use. Yet as graphs grow more complex, these depictions can become difficult to understand. Quilts are matrix-based depictions for layered graphs designed to address this problem. In this research, we first improve Quilts by developing three design alternatives, and then compare the best of these alternatives to better-known node-link and matrix depictions. A primary weakness in Quilts is their depiction of skip links, links that do not simply connect to a succeeding layer. Therefore in our first study, we compare Quilts using color-only, text-only, and mixed (color and text) skip link depictions, finding that path finding with the color-only depiction is significantly slower and less accurate, and that in certain cases, the mixed depiction offers an advantage over the text-only depiction. In our second study, we compare Quilts using the mixed depiction to node-link diagrams and centered matrices. Overall results show that users can find paths through graphs significantly faster with Quilts (46.6 secs) than with node-link (58.3 secs) or matrix (71.2 secs) diagrams. This speed advantage is still greater in large graphs (e.g. in 200 node graphs, 55.4 secs vs. 71.1 secs for node-link and 84.2 secs for matrix depictions).","graph drawing, layered graphs, matrix based depiction, node-link diagram.",2268,2268-2275,Juhee,Bae,North Carolina State University,Benjamin,Watson,North Carolina State University,,,,,,,,,,,,,,,,,,,,,