Paper ID,Paper Title,Abstract,Keywords,starting page,page range,Author 1: First Name,Author 1: Surname,Author 1: Affiliation,Author 2: First Name,Author 2: Surname,Author 2: Affiliation,Author 3: First Name,Author 3: Surname,Author 3: Affiliation,Author 4: First Name,Author 4: Surname,Author 4: Affiliation,Author 5: First Name,Author 5: Surname,Author 5: Affiliation,Author 6: First Name,Author 6: Surname,Author 6: Affiliation,Author 7: First Name,Author 7: Surname,Author 7: Affiliation,Author 8: First Name,Author 8: Surname,Author 8: Affiliation,Author 9: First Name,Author 9: Surname,Author 9: Affiliation125,Arc Length-Based Aspect Ratio Selection,"The aspect ratio of a plot has a dramatic impact on our ability to perceive trends and patterns in the data. Previous approaches for automatically selecting the aspect ratio have been based on adjusting the orientations or angles of the line segments in the plot. In contrast, we recommend a simple, effective method for selecting the aspect ratio: minimize the arc length of the data curve while keeping the area of the plot constant. The approach is parameterization invariant, robust to a wide range of inputs, preserves visual symmetries in the data, and is a compromise between previously proposed techniques. Further, we demonstrate that it can be effectively used to select the aspect ratio of contour plots. We believe arc length should become the default aspect ratio selection method.","Aspect ratio selection, Banking to 45 degrees, Orientation resolution.",2276,2276-2282,Justin,Talbot,Stanford University,John,Gerth,Stanford University,Pat,Hanrahan,Stanford University,,,,,,,,,,,,,,,,,,314,Asymmetric Relations in Longitudinal Social Networks,"In modeling and analysis of longitudinal social networks, visual exploration is used in particular to complement and inform other methods. The most common graphical representations for this purpose appear to be animations and small multiples of intermediate states, depending on the type of media available. We present an alternative approach based on matrix representation of gestaltlines (a combination of Tufte's sparklines with glyphs based on gestalt theory). As a result, we obtain static, compact, yet data-rich diagrams that support specifically the exploration of evolving dyadic relations and persistent group structure, although at the expense of cross-sectional network views and indirect linkages.","Network Visualization, Social Networks, Time Series Data, Visual Knowledge Discovery and Representation, Glyphbased Techniques.",2283,2283-2290,Ulrik,Brandes,University of Konstanz,Bobo,Nick,University of Konstanz,,,,,,,,,,,,,,,,,,,,,160,"VisBricks: Multiform Visualization of Large, Inhomogeneous Data","Large volumes of real-world data often exhibit inhomogeneities: vertically in the form of correlated or independent dimensions and horizontally in the form of clustered or scattered data items. In essence, these inhomogeneities form the patterns in the data that researchers are trying to find and understand. Sophisticated statistical methods are available to reveal these patterns, however, the visualization of their outcomes is mostly still performed in a one-view-fits-all manner. In contrast, our novel visualization approach, VisBricks, acknowledges the inhomogeneity of the data and the need for different visualizations that suit the individual characteristics of the different data subsets. The overall visualization of the entire data set is patched together from smaller visualizations, there is one VisBrick for each cluster in each group of interdependent dimensions. Whereas the total impression of all VisBricks together gives a comprehensive high-level overview of the different groups of data, each VisBrick independently shows the details of the group of data it represents. State-of-the-art brushing and visual linking between all VisBricks furthermore allows the comparison of the groupings and the distribution of data items among them. In this paper, we introduce the VisBricks visualization concept, discuss its design rationale and implementation, and demonstrate its usefulness by applying it to a use case from the field of biomedicine.","Inhomogeneous data, multiple coordinated views, multiform visualization.",2291,2291-2300,Alexander,Lex,Graz University of Technology,Hans-Joerg,Schulz,Graz University of Technology,Marc,Streit,Graz University of Technology,Christian,Partl,Graz University of Technology,Dieter,Schmalstieg,Graz University of Technology ,,,,,,,,,,,,150,D3: Data-Driven Documents,"Data-Driven Documents (D3) is a novel representation-transparent approach to visualization for the web. Rather than hide the underlying scenegraph within a toolkit-specific abstraction, D3 enables direct inspection and manipulation of a native representation: the standard document object model (DOM). With D3, designers selectively bind input data to arbitrary document elements, applying dynamic transforms to both generate and modify content. We show how representational transparency improves expressiveness and better integrates with developer tools than prior approaches, while offering comparable notational efficiency and retaining powerful declarative components. Immediate evaluation of operators further simplifies debugging and allows iterative development. Additionally, we demonstrate how D3 transforms naturally enable animation and interaction with dramatic performance improvements over intermediate representations.","Information visualization, user interfaces, toolkits, 2D graphics.",2301,2301-2309,Michael,Bostock,Stanford University,Vadim,Ogievetsky,Stanford University,Jeffrey,Heer,Stanford University,,,,,,,,,,,,,,,,,,153,Flexible Linked Axes for Multivariate Data Visualization,"Multivariate data visualization is a classic topic, for which many solutions have been proposed, each with its own strengths and weaknesses. In standard solutions the structure of the visualization is fixed, we explore how to give the user more freedom to define visualizations. Our new approach is based on the usage of Flexible Linked Axes: The user is enabled to define a visualization by drawing and linking axes on a canvas. Each axis has an associated attribute and range, which can be adapted. Links between pairs of axes are used to show data in either scatter plot- or Parallel Coordinates Plot-style. Flexible Linked Axes enable users to define a wide variety of different visualizations. These include standard methods, such as scatter plot matrices, radar charts, and PCPs [11]; less well known approaches, such as Hyperboxes [1], TimeWheels [17], and many-to-many relational parallel coordinate displays [14]; and also custom visualizations, consisting of combinations of scatter plots and PCPs. Furthermore, our method allows users to define composite visualizations that automatically support brushing and linking. We have discussed our approach with ten prospective users, who found the concept easy to understand and highly promising.","Multivariate data, visualization, scatter plot, Parallel Coordinates Plot.",2310,2310-2316,Jarry H.T.,Claessen,Eindhoven University of Technology,Jarke J.,van Wijk,Eindhoven University of Technology,,,,,,,,,,,,,,,,,,,,,228,Synthetic Generation of High-dimensional Datasets,"Generation of synthetic datasets is a common practice in many research areas. Such data is often generated to meet specific needs or certain conditions that may not be easily found in the original, real data. The nature of the data varies according to the application area and includes text, graphs, social or weather data, among many others. The common process to create such synthetic datasets is to implement small scripts or programs, restricted to small problems or to a specific application. In this paper we propose a framework designed to generate high dimensional datasets. Users can interactively create and navigate through multi dimensional datasets using a suitable graphical user-interface. The data creation is driven by statistical distributions based on a few user-defined parameters. First, a grounding dataset is created according to given inputs, and then structures and trends are included in selected dimensions and orthogonal projection planes. Furthermore, our framework supports the creation of complex non-orthogonal trends and classified datasets. It can successfully be used to create synthetic datasets simulating important trends as multidimensional clusters, correlations and outliers.","Synthetic data generation, multivariate data, high-dimensional data, interaction.",2317,2317-2324,Georgia,Albuquerque,TU Braunschweig,Thomas,Löwe,TU Braunschweig,Marcus,Magnor,TU Braunschweig,,,,,,,,,,,,,,,,,,232,Stereoscopic Highlighting: 2D Graph Visualization on Stereo Displays,"In this paper we present a new technique and prototype graph visualization system, stereoscopic highlighting, to help answer accessibility and adjacency queries when interacting with a node-link diagram. Our technique utilizes stereoscopic depth to highlight regions of interest in a 2D graph by projecting these parts onto a plane closer to the viewpoint of the user. This technique aims to isolate and magnify specific portions of the graph that need to be explored in detail without resorting to other highlighting techniques like color or motion, which can then be reserved to encode other data attributes. This mechanism of stereoscopic highlighting also enables focus+context views by juxtaposing a detailed image of a region of interest with the overall graph, which is visualized at a further depth with correspondingly less detail. In order to validate our technique, we ran a controlled experiment with 16 subjects comparing static visual highlighting to stereoscopic highlighting on 2D and 3D graph layouts for a range of tasks. Our results show that while for most tasks the difference in performance between stereoscopic highlighting alone and static visual highlighting is not statistically significant, users performed better when both highlighting methods were used concurrently. In more complicated tasks, 3D layout with static visual highlighting outperformed 2D layouts with a single highlighting method. However, it did not outperform the 2D layout utilizing both highlighting techniques simultaneously. Based on these results, we conclude that stereoscopic highlighting is a promising technique that can significantly enhance graph visualizations for certain use cases.","graph visualization, stereo displays, virtual reality.",2325,2325-2333,Basak,Alper,"UC Santa Barbara, MAT",Tobias,Hollerer,"UC Santa Barbara, CS",JoAnn,Kuchera-Morin,"UC Santa Barbara, MAT",Angus,Forbes,"UC Santa Barbara, MAT",,,,,,,,,,,,,,,142,In Situ Exploration of Large Dynamic Networks,"The analysis of large dynamic networks poses a challenge in many fields, ranging from large bot-nets to social networks. As dynamic networks exhibit different characteristics, e.g., being of sparse or dense structure, or having a continuous or discrete time line, a variety of visualization techniques have been specifically designed to handle these different aspects of network structure and time. This wide range of existing techniques is well justified, as rarely a single visualization is suitable to cover the entire visual analysis. Instead, visual representations are often switched in the course of the exploration of dynamic graphs as the focus of analysis shifts between the temporal and the structural aspects of the data. To support such a switching in a seamless and intuitive manner, we introduce the concept of in situ visualization– a novel strategy that tightly integrates existing visualization techniques for dynamic networks. It does so by allowing the user to interactively select in a base visualization a region for which a different visualization technique is then applied and embedded in the selection made. This permits to change the way a locally selected group of data items, such as nodes or time points, are shown – right in the place where they are positioned, thus supporting the user's overall mental map. Using this approach, a user can switch seamlessly between different visual representations to adapt a region of a base visualization to the specifics of the data within it or to the current analysis focus. This paper presents and discusses the in situ visualization strategy and its implications for dynamic graph visualization. Furthermore, it illustrates its usefulness by employing it for the visual exploration of dynamic networks from two different fields: model versioning and wireless mesh networks.","Dynamic graph data, multiform visualization, multi-focus+context.",2334,2334-2343,Steffen,Hadlak,University of Rostock,Hans-Jörg,Schulz,Graz University of Technology,Heidrun,Schumann,University of Rostock,,,,,,,,,,,,,,,,,,155,Parallel Edge Splatting for Scalable Dynamic Graph Visualization,"We present a novel dynamic graph visualization technique based on node-link diagrams. The graphs are drawn side-byside from left to right as a sequence of narrow stripes that are placed perpendicular to the horizontal time line. The hierarchically organized vertices of the graphs are arranged on vertical, parallel lines that bound the stripes; directed edges connect these vertices from left to right. To address massive overplotting of edges in huge graphs, we employ a splatting approach that transforms the edges to a pixel-based scalar field. This field represents the edge densities in a scalable way and is depicted by non-linear color mapping. The visualization method is complemented by interaction techniques that support data exploration by aggregation, filtering, brushing, and selective data zooming. Furthermore, we formalize graph patterns so that they can be interactively highlighted on demand. A case study on software releases explores the evolution of call graphs extracted from the JUnit open source software project. In a second application, we demonstrate the scalability of our approach by applying it to a bibliography dataset containing more than 1.5 million paper titles from 60 years of research history producing a vast amount of relations between title words.","Dynamic graph visualization, graph splatting, software visualization, software evolution.",2344,2344-2353,Michael,Burch,"VISUS, University of Stuttgart",Corinna,Vehlow,"VISUS, University of Stuttgart",Fabian,Beck,University of Trier,Stephan,Diehl,University of Trier,Daniel,Weiskopf,"VISUS, University of Stuttgart",,,,,,,,,,,,236,Divided Edge Bundling for Directional Network Data,"The node-link diagram is an intuitive and venerable way to depict a graph. To reduce clutter and improve the readability of node-link views, Holten & van Wijk's force-directed edge bundling employs a physical simulation to spatially group graph edges. While both useful and aesthetic, this technique has shortcomings: it bundles spatially proximal edges regardless of direction, weight, or graph connectivity. As a result, high-level directional edge patterns are obscured. We present divided edge bundling to tackle these shortcomings. By modifying the forces in the physical simulation, directional lanes appear as an emergent property of edge direction. By considering graph topology, we only bundle edges related by graph structure. Finally, we aggregate edge weights in bundles to enable more accurate visualization of total bundle weights. We compare visualizations created using our technique to standard force-directed edge bundling, matrix diagrams, and clustered graphs; we find that divided edge bundling leads to visualizations that are easier to interpret and reveal both familiar and previously obscured patterns.","Graph visualization, aggregation, node-link diagrams, edge bundling, physical simulation.",2354,2354-2363,David,Selassie,Stanford University,Brandon,Heller,Stanford University,Jeffrey,Heer,Stanford University,,,,,,,,,,,,,,,,,,331,Skeleton-Based Edge Bundling for Graph Visualization,"In this paper, we present a novel approach for constructing bundled layouts of general graphs. As layout cues for bundles, we use medial axes, or skeletons, of edges which are similar in terms of position information. We combine edge clustering, distance fields, and 2D skeletonization to construct progressively bundled layouts for general graphs by iteratively attracting edges towards the centerlines of level sets of their distance fields. Apart from clustering, our entire pipeline is image-based with an efficient implementation in graphics hardware. Besides speed and implementation simplicity, our method allows explicit control of the emphasis on structure of the bundled layout, i.e. the creation of strongly branching (organic-like) or smooth bundles. We demonstrate our method on several large real-world graphs. Understanding these models, however, is challenging because they require scientists to quantify and compare multiscale spatialtemporal patterns. A large series of coordinated or sequential plots must be generated, individually programmed, and manually composed for analysis. This hampers the exploration and is a barrier to making the cross-species comparisons that are essential for coordinating conservation and extracting important ecological information. To address these limitations, as part of a collaboration among computer scientists, statisticians, biologists and ornithologists, we have developed BirdVis, an interactive visualization system that supports the analysis of spatio-temporal bird distribution models. BirdVis leverages visualization techniques and uses them in a novel way to better assist users in the exploration of interdependencies among model parameters. Furthermore, the system allows for comparative visualization through coordinated views, providing an intuitive interface to identify relevant correlations and patterns. We justify our design decisions and present case studies that show how BirdVis has helped scientists obtain new evidence for existing hypotheses, as well as formulate new hypotheses in their domain.","Graph layouts, edge bundles, image-based information visualization.",2364,2364-2373,Ozan,Ersoy,"University of Groningen, The Netherlands",Christophe,Hurter,"DGAC/DSNA, Toulouse, France",Fernando,Paulovich,"University of Sao Paulo, Sao Carlos/SP, Brazil",Gabriel,Cantareiro,"University of Sao Paulo, Sao Carlos/SP, Brazil",Alex,Telea,"University of Groningen, The Netherlands",,,,,,,,,,,,258,BirdVis: Visualizing and Understanding Bird Populations,"Birds are unrivaled windows into biotic processes at all levels and are proven indicators of ecological well-being. Understanding the determinants of species distributions and their dynamics is an important aspect of ecology and is critical for conservation and management. Through crowdsourcing, since 2002, the eBird project has been collecting bird observation records. These observations, together with local-scale environmental covariates such as climate, habitat, and vegetation phenology have been a valuable resource for a global community of educators, land managers, ornithologists, and conservation biologists. By associating environmental inputs with observed patterns of bird occurrence, predictive models have been developed that provide a statistical framework to harness available data for predicting species distributions and making inferences about species-habitat associations.",Ornithology; species distribution models; multiscale analysis; spatial data; temporal data.,2374,2374-2383,Nivan,Ferreira,University of Utah,Lauro,Lins,University of Utah,Daniel,Fink,Cornell Lab of Ornithology,Steve,Kelling,Cornell Lab of Ornithology,Christopher,Wood,Cornell Lab of Ornithology,Juliana,Freire,University of Utah,Claudio,Silva,University of Utah,,,,,,303,BallotMaps: Detecting Name Bias in Alphabetically Ordered Ballot Papers,"The relationship between candidates' position on a ballot paper and vote rank is explored in the case of 5000 candidates for the UK 2010 local government elections in the Greater London area. This design study uses hierarchical spatially arranged graphics to represent two locations that affect candidates at very different scales: the geographical areas for which they seek election and the spatial location of their names on the ballot paper. This approach allows the effect of position bias to be assessed; that is, the degree to which the position of a candidate's name on the ballot paper influences the number of votes received by the candidate, and whether this varies geographically. Results show that position bias was significant enough to influence rank order of candidates, and in the case of many marginal electoral wards, to influence who was elected to government. Position bias was observed most strongly for Liberal Democrat candidates but present for all major political parties. Visual analysis of classification of candidate names by ethnicity suggests that this too had an effect on votes received by candidates, in some cases overcoming alphabetic name bias. The results found contradict some earlier research suggesting that alphabetic name bias was not sufficiently significant to affect electoral outcome and add new evidence for the geographic and ethnicity influences on voting behaviour. The visual approach proposed here can be applied to a wider range of electoral data and the patterns identified and hypotheses derived from them could have significant implications for the design of ballot papers and the conduct of fair elections.","Voting, election, bias, democracy, governance, treemaps, geovisualization, hierarchy, governance.",2384,2384-2391,Jo,Wood,"giCentre, City University London",Donia,Badawood,"giCentre, City University London",Jason,Dykes,"giCentre, City University London",Aidan,Slingsby,"giCentre, City University London",,,,,,,,,,,,,,,349,Sequence Surveyor: Leveraging Overview for Scalable Genomic Alignment Visualization,"In this paper, we introduce overview visualization tools for large-scale multiple genome alignment data. Genome alignment visualization and, more generally, sequence alignment visualization are an important tool for understanding genomic sequence data. As sequencing techniques improve and more data become available, greater demand is being placed on visualization tools to scale to the size of these new datasets. When viewing such large data, we necessarily cannot convey details, rather we specifically design overview tools to help elucidate large-scale patterns. Perceptual science, signal processing theory, and generality provide a framework for the design of such visualizations that can scale well beyond current approaches. We present Sequence Surveyor, a prototype that embodies these ideas for scalable multiple whole-genome alignment overview visualization. Sequence Surveyor visualizes sequences in parallel, displaying data using variable color, position, and aggregation encodings. We demonstrate how perceptual science can inform the design of visualization techniques that remain visually manageable at scale and how signal processing concepts can inform aggregation schemes that highlight global trends, outliers, and overall data distributions as the problem scales. These techniques allow us to visualize alignments with over 100 whole bacterial-sized genomes.","Bioinformatics Visualization, Perception Theory, Scalability Issues, Visual Design.",2392,2392-2401,Danielle,Albers,University of Wisconsin-Madison,Colin,Dewey,University of Wisconsin-Madison,Michael,Gleicher,University of Wisconsin-Madison,,,,,,,,,,,,,,,,,,100,Visualization of Parameter Space for Image Analysis,"Image analysis algorithms are often highly parameterized and much human input is needed to optimize parameter settings. This incurs a time cost of up to several days. We analyze and characterize the conventional parameter optimization process for image analysis and formulate user requirements. With this as input, we propose a change in paradigm by optimizing parameters based on parameter sampling and interactive visual exploration. To save time and reduce memory load, users are only involved in the first step - initialization of sampling - and the last step - visual analysis of output. This helps users to more thoroughly explore the parameter space and produce higher quality results. We describe a custom sampling plug-in we developed for CellProfiler - a popular biomedical image analysis framework. Our main focus is the development of an interactive visualization technique that enables users to analyze the relationships between sampled input parameters and corresponding output. We implemented this in a prototype called Paramorama. It provides users with a visual overview of parameters and their sampled values. User-defined areas of interest are presented in a structured way that includes image-based output and a novel layout algorithm. To find optimal parameter settings, users can tag high- and low-quality results to refine their search. We include two case studies to illustrate the utility of this approach.","Information visualization, visual analytics, parameter space, image analysis, sampling.",2402,2402-2411,A. Johannes,Pretorius,"School of Computing, University of Leeds",Mark-Anthony,Bray,Broad Institute of MIT and Harvard,Anne E.,Carpenter,Broad Institute of MIT and Harvard,Roy A.,Ruddle,"School of Computing, University of Leeds",,,,,,,,,,,,,,,